연번,용어명,용어설명,유사용어
269,리밍비트,구멍을 확공시킬때에 사용하는 비트이며 형상은 피쉬 테일(fish tail)비트 중앙에 파이프의 유도장치를 붙인 것과 같은 모양을 하고 있다. 큰 구멍을 굴착할 때에 좋으나 구멍이 공곡 되는 것을 방지하기 위해 먼저 작은 구멍을 뚫고 이것을 유도공으로 삼아 다시 크게 뚫어간다.,reaming bit
270,리밍쉘,드릴로드에 사용된다.,reaming shele
271,리팅거의이론,분쇄에 필요한 일의 양은 분쇄 결과 새로 생긴 면의 넓이에 비례한다는 이론.,
272,마그마,"화산이 폭발하면서 흘러내린 용암이 굳어져서 암석이 되는 현상은 오늘날에도 쉽게 목격할 수 있다. 이것은 지하에 있는 암석의 용융체가 지표로 흘러 나와 굳어진 것으로서, 이 용융체를 마그마라고 한다. 마그마는 지각의 하부 또는 맨틀(mantle)의 상부에서 생기며, 특히 화산 지대의 하부에 많은 것으로 추정된다. 대부분의 마그마는 지표로 나오지 못하고 지각 내에서 냉각, 고화되어 암석으로 되는데, 마그마가 굳어져서 된 모든 암석이 화성암이다.",magma
273,마그마성광상,"마그마의 고결작용에 관계되어 생긴 광상을 총칭한다. 마그마분화광상(分化鑛床) ·마그마화성광상(火成鑛床)이라고도 한다. 마그마가 냉각 ·고결하는 과정에서 온도 ·압력조건의 차이에 따라 화성암의 조암광물이 정출(晶出)되는 시기에 생성되는 정(正)마그마광상, 그 후의 휘발성 성분이 많은 시기의 페그마타이트 광상, 온도가 물의 임계온도(臨界溫度) 374 ℃에 접근하여 휘발성 성분이 잔액(殘液)과 반응하여 특징적인 광물을 정출하는 기성광상(氣成鑛床) ·열수광상(熱水鑛床) 등이 있다.",Ore deposit of magnetic origin
274,마찰감도,"화약류의 마찰감도는 마찰에 의한 폭발 감도를 나타내는 것으로, 모르타르 시험과 마찰 시험을 통하여 측정할 수 있다.",
275,마찰시험,"라스버그(Rathsburg)가 고안한 감도 시험기는, 회전하는 철판과 고정된 철제 시험 기구 사이에 화약 시료를 넣고, 회전판의 속도를 매분 20-80회 정도로 하여 회전판의 압력을 25㎏/㎠까지 올리면서 시료를 마찰시키면서 시험하도록 되어 있다.",
276,막장,"석탄, 금속 등의 광산에서 석탄, 광석 등을 채굴하고 또는 갱도 굴진을 하고 있는 작업 개소를 말한다. 노천채굴의 작업장도 막장이라고 한다. 광석이나 석탄을 채굴하는 곳을 채굴막장이라 하고, 갱도를 만들기 위해 암석 ·석탄 속을 굴진하고 있는 곳을 굴진막장이라 한다. 굴진막장이나 채굴막장은 모두 낙반을 방지하기 위해 목재 ·철재 등을 사용해서 지보(支保)를 해야 하는데, 막장이 매일 전진하기 때문에 한 곳의 지주 사용기간이 짧으므로, 쉽게 시공할 수 있고 회수할 수 있는 구조로 제작해야 한다.","幕場, Working face"
277,막장반압,"갱내 반압은 암석 갱도보다 광석이나 석탄을 채굴하는 막장에 더욱 심하게 작용하나, 특히 채탄 막장의 지압은 가장 활발하다. 그 이유는, 석탄의 채굴 공동이 다른 공동에 비하여 훨씬 클 뿐 아니라, 공동이 생기는 속도로 빨라 계속 다른 상태의 동지압이 격렬하게 작용하기 때문이다.",
278,말구,위아래를 자른 통나무의 가는쪽 끝머리의 지름.,末口
279,망상산물,"체질 작업은 일정한 크기와 구멍을 가진 체로 광립을 크고 작은 것으로 분리하는 것이며, 체질한 결과 체에 남은 것을 말함. 체는 철판에 원, 정사각형, 직사각형 및 긴 타원형 등 여러 가지 구멍을 뚫은 것도 있고, 구멍이 작을 때에는 철사로 그물을 짜서 만든 것도 있다. 이 때, 체눈의 크기는 지름 또는 짧은 변의 간격으로 나타낸다. 보통 가장 정확하게 크기를 결정할 수 있는 것은 원형이므로 체눈의 형태는 원형의 구멍이 좋으나, 이것은 제작상 또는 체질의 효율상 체눈의 형태가 큰 것에 한해서 사용이 가능하다.",oversize product
280,망하산물,"체질 작업은 일정한 크기와 구멍을 가진 체로 광립을 크고 작은 것으로 분리하는 것이며, 체질한 결과 체눈을 통과한 것을 말함.",undersize product
281,매리애나해구,"세계에서 가장 깊은 해연. 매리애나 해구중에 깊이 11,034m의 비티아즈해연과 10,863m의 챌린저 해연이 있다.",
282,매장량,"광상(탄층,광물)유층·가스층 내에 존재하고 있는 석탄량, 광물량, 유량 및 가스량을 지칭하며, 통상 지표 조건하에 환산한 체적으로 표시한다. 어느 시점 이후 적절한 조건하에서 채취할 수 있는 양을 그 시점에 있어서의 가채매장량이라 한다.","埋藏量, Reserves"
283,매픽암,"진한 색깔을 띠는 흑운모, 각섬석, 휘석 및 사장석을 주성분으로 한다.화성암을 마그마의 냉각속도, 깊이 또는 조직과 색깔을 기준으로 분류하면 아래와 같다. 표에서도 보듯이 유문암과 화강암은 비슷한 색깔을 띠나 조직이 서로 다르고, 화강암과 섬록암은 색은 다르지만 조직이 같은 암석임을 알 수있다. 화성암은 화학 성분에 따라 더욱 세분되어 수십 가지의 암석으로 분류된다.","mafic, 유색암 또는염기성암"
284,맥석,"광맥에서 광석 광물과 함께 산출되는 경제적으로 별로 가치가 없는 광물. 맥석광물은 동의의 석질 또는 토질의 비금속 광석이 많고, 때로는 경제적으로 무가치한 금속광물을 말하기도 한다. 구리광상에서 보면 구리광석은 황동광이며, 가장 흔한 맥석은 석영인데, 방해석 ·녹니석 ·전기석 등도 맥석으로 취급한다. 소량으로 함께 나는 황철광 ·섬아연광 등의 광석도 맥석이라 하는 경우가 있다.","脈石, gangue"
285,맨틀,"지구의 고체부분 중 표층(地殼)을 제외한 부분. 지표에서 깊이 30km의 모호로비치치 불연속면에서 지하 2,900km의 구텐베르크 불연속면, 즉 외핵(外核)까지의 사이를 가리킨다. 지구 부피의 82% 이상, 질량에서는 68%를 차지하며 화학조성도 직접 알 수 없으나 운석(隕石)의 화학조성에서 유추하면 철 ·마그네슘의 규산염을 주성분으로 하는 암석일 것으로 추정된다. 이것은 지구 중심부의 핵(코어)이 금속 액체로 되어 있는 것과 대조적이다. 각종 지진파(地震波)의 전파 연구로부터 맨틀에는 층구조(層構造)가 존재할 것으로 추정된다. 따라서 상부맨틀(upper mantle) ·점이층(漸移層) ·하부맨틀(lower mantle)로 구분한다. 지각 바로 아래부터 수십 또는 100km의 부분에서는 지진파의 속도가 깊이와 더불어 증대한다. 이 부분은 지구의 굳은 표피 같은 것으로, 약 20개 미만의 부분으로 나뉘어 지구를 둘러싸고 있다. 그 각각은 판(板:plate)이라고 하며, 그것들이 서로 상대운동을 함으로써 여러 가지 지질현상이나 지진이 일어난다고 한다(판구조론). 이 층 밑에는 지진파의 속도가 감소하는 저속도층(低速度層)이 존재한다. 저속도의 원인은 이 부분이 고온 때문에 부분용융상태에 있다는 설이 유력하다. 맨틀 상부는 주로 감람암(감람석과 휘석)으로 구성되어 있는데, 깊이 약 400km쯤에서 고압 때문에 감람석은 결정변태(結晶變態)를 일으켜 스피넬상(相)이 되어 지진파 속도나 밀도가 갑자기 증가한다. 또 그 이상의 심부(1,000km 이상)에서는 다른 상전이(相轉移)나 분해가 일어나서 맨틀물질은 산화물의 혼합체가 된다. 맨틀내부의 온도는 아직 확실하게 밝혀져 있지는 않으나, 철이나 규산염의 녹는점으로 보아 최상부는 약 1,000℃, 최하부는 약 5,000℃인 것으로 추정된다.",mantle
286,맴돌이저항,"침강하는 광립의 속도가 크면 그 뒤에 유체의 소용돌이가 생겨 광립은 이 저항의 영향을 크게 받는데, 이 저항을 맴돌이 저항이라 한다.",eddly resitance
287,맹도,"화약류의 폭력을 나타내기 위한 것으로서, 화약류가 폭발하여 최대 압력을 나타낼 때까지의 기간과도 깊은 관계가 있다. 화약류의 맹도는 다음 식으로 표시된다. B=ρ·V·S B : 맹도 ρ : 폭약의 밀도 V : 폭발 속도 S : 폭발 가스의 속도 즉 , 화약의 맹도는 폭약의 운동 에너지라 할 수 있으며, 폭약의 밀도, 폭발 속도, 폭발 가스의 전파 속도의 곱으로 나타낼 수 있다.",
288,먼지조절,"최근 우리 나라는 급진적인 공업화에 따라 여러 형태의 공해로 많은 문제점들이 제시되고 있으며, 선별장에서 광석의 파분쇄 공정 및 그 밖의 건식 처리 공정에서는 많은 먼지가 발생하고 있다. 이 먼지는 유용광물의 손실과 인체에 심각한 해독을 끼치고 있으므로, 선진 국가들은 이미 직업인의 건강과 안전 및 작업 환경의 개선, 더 나아가서는 자연 환경 보호를 위해 먼지 조절은 물론, 여러 가지의 공해를 방지하기 위하여 상당한 비용을 투자하고, 그 해결 방법을 위하여 많이 노력하고 있다.",dust contorl
289,메시,체를 엮은 철사의 길이 1인치(25.4㎜) 사이에 들어 있는 구멍의 수를 말함.,mesh
290,메탈크라운비트,"금속과 다이아몬드를 붙인 금속 막대의 끝 부분을 크라운 비트라고 한다. 다이아몬드는 값이 비싸기 때문에 매우 단단하고 균질인 암석에 주로 사용되며, 견고하지 않은 암석에서는 비싼 다이아몬드의 손실과 시추 비용의 절감을 위하여 다이아몬드 대신 경도가 큰 특수 합금의 금속으로 된 메탈 크라운 비트를 흔히 사용한다.",metal crown bit
291,면압권,"지하의 공동(空洞) 주위의 응력(應力), 즉 지압(地壓)이 없어진 상태에 있는 것으로 생각되는 부분. 지하에 공동이 생기면 암반 속에 공동이 없었을 때 지압의 평형상태는 교란된다. 공동부분에 존재하던 암석이 제거되어 위에 겹쳐 있던 암석층의 압력 지지는 공동 주위의 암석에 맡겨진다. 따라서 주위의 암석은 부가적인 하중을 받는다. 일반적으로 공동의 측벽에서는 압축응력이 강하고, 천장과 바닥에서는 인장응력이 작용하게 되는 경우가 많다. 암석은 인장응력에 대해서는 일반적으로 약하고, 압축강도의 1/10∼1/20의 응력으로 파단(破斷)되므로, 공동의 천장 ·바닥 부분에는 전단응력(剪斷應力)의 작용도 받아 많은 균열(龜裂)이 발생하여, 암석에는 갈라진 틈이 생기고, 그 결과 깨져서 무너진다. 균열이 생기면 처진 부분은 아직 처지지 않은 단단한 부분으로부터 분리되어, 어느 정도 또는 완전히 응력이 작용하지 않는 상태가 된다. 이와 같이 공동의 주위, 특히 천장 ·바닥의 응력, 즉 지압이 없어진 상태라고 생각되는 부분을 광산 ·탄광에서는 면압권 또는 면압대(免壓帶)라고 한다. 따라서 지하의 석탄을 채굴한 자리의 천장에는 넓은 범위의 면압권이 존재하고, 갱도의 천장에도 존재하는 경우가 있다.","免壓圈, Trompeter zone"
292,명장,산업현장에 장기간 종사한 자로서 투철한 장인정신과 해당분야 최고의 기술수준을 갖춘자 중 기술발전에 크게 공헌하여 노동부장관 이 일 정한 수준에 의거 선정한 자를 말함,明匠
293,명주광택,"광물의 표면이나 쪼개진면에서 반사되는 빛을 광택이라 한다. 광택은 금속 광택, 아금속 광택, 비금속 광택등으로 구분 되며 금속 광택은 금속과 같은 센광택, 아금속 광택은 금속 광택과 비슷한데 약간 약한 광택 비금속 광택은 아주 약한 광택을 말한다. 명주광택은 이 중 아금속 광택에 해당한다. 섬유, 석고, 석면이 명주광택에 해당한다.",明紬光澤
294,모서리각,접촉각.,edge angle
295,모암,"관입암체(貫入岩體)나 광상(鑛床)을 배태하는 주위의 암석. 어떤 광상이 제3기의 이암(泥岩) 중에 배태되어 있는 경우, 이 광상의 모암은 제3기의 이암이다. 또 광상의 생성에서 열수작용이 모암에 미치면 변질작용이 일어나는데, 모암의 변질에는 고령토화(高嶺土化) ·몬모릴로나이트화 ·적운모화(績雲母化) ·녹니석화(綠泥石化) ·규화(硅化) 등이 있고, 이들 변질대는 광상을 사이에 끼고 양쪽에 배열되는 경우가 많다. 따라서 모암의 변질대의 조사 결과를 단서로 하여 광상을 탐사하기도 한다.","母巖, country rock"
296,모오스경도계,광물의 굳기의 정도를 모오스가 10종으로 구분한 것을 모오스 경도계라 한다.,
297,목재지보,"지하에 갱도를 개설하거나 광석을 채굴할 때 지보를 시공하게 된다. 지보의 목적은 첫째, 낙반으로 인한 재해를 예방하는 데 있고, 둘째, 갱도나 공동의 단면적을 유지하여 광차나 사람이 자유롭게 다닐 수 있게 하는 동시에, 필요한 공기가 유통될 수 있도록 하는 데 있다. 목재지보의 경우는 채탄 막장과 같이 사용기간이 짧은 갱도에서 많이 사용한다.",木材支保
298,목적,"갱목을 가로, 세로로 쌓아서 천장을 지지하는 것을 목적이라 한다. 상하반이 수평일 때에는 목적을 만들기가 쉬우나, 경사가 심하면 미끄러져 내려갈 염려가 있으므로 기둥을 박아 준다. 목적의 네 모서리는 언제나 일직선 위에 있게 하여야 한다. 속이 빈 목적은 막장에 널리 쓰이고, 속을 버력 등으로 채운 목적은 채굴한 장소의 벽을 튼튼하게 하는 데 사용된다. 목적의 세기는 그 구조에 따라 다르지만 속을 채운 목적이 속이 빈 목적보다 약 6배의 강도를 가진다고 한다. 그러나 속을 채운 목적은 많은 갱목을 버리게 되므로, 속은 버력 등으로 채운다.","木積,crib"
299,목탄,"목재를 공기의 공급을 차단하고 가열하거나, 또는 공기를 아주 적게 하여 가열하였을 때 생기는 고체 생성물. 숯이라고도 한다. 재료로는 일반적으로 재질(材質)이 단단한 나무가 사용되며, 한국에서는 참나무류(갈참나무 ·굴참나무 ·물참나무 ·줄참나무 등)가 주로 사용된다. 참나무류로 만든 숯을 참숯이라고 하는데, 이것은 질이 낮은 검탄(黔炭)과 질이 좋은 백탄(白炭)으로 분류된다. 숯에는 이 밖에 건류탄과 뜬숯이 있다. 그리고 숯을 만들 때는 목가스 ·목초산 ·목타르 등이 부생(副生)한다. 제탄법(製炭法)에는 무개제탄법(無蓋製炭法) ·퇴적제탄법 ·갱내제탄법 ·축요제탄법(築窯製炭法) 등이 있으나 한국에서는 주로 축요제탄법이 사용되고 있다. 축요제탄법이란 숯가마를 쌓고 그 안에 목재를 넣어서 굽는 방법인데, 검탄과 백탄은 이 방법으로 만든다. 가정용 연료로 많이 사용되었으나, 연탄 ·석유 ·전기 ·가스 등의 이용률이 커짐에 따라 가정용으로는 거의 사용되지 않고 있다.","木炭, charcoal, C"
300,무극기,"이극성 물질(heteropolar substance)의 하나. 계면 활성 물질의 특성은 그 분자의 화학 구조로부터 설명할 수가 있다. 일반적으로 탄소 수가 많은 것은 물에 잘 용해되지 않으며, 탄소 수가 적은 것은 물에 용해된다. 그 이유는 이들의 산이나 알코올 분자들은 물과 결합하는 부분과 물과 결합하지 않는 부분으로 구성되어 있기 때문이다. 예를 들면, CH3·(CH2)n­,CH3·C6H4-등은 물에 용해되지 않는 부분으로서 이것을 무극기라고 한다.",nonpolar part
301,무색암,달리 산성암 또는 펠식(felsic)암으로 불리며 엷은 색깔을 띠며 주로 석영 장석으로 구성된다.,無色岩
302,무연탄,"우리나라에서 생산되는 석탄의 대부부은 무연탄이다. 대부분 검정색으로 탄소의 양은 많으나 불이 늦게 붙으며 탈 때 연기가 나지 않아 무연탄이라 부른다. 주로 연료용과 발전용으로 쓰이며, 연소시 일산화탄소(CO)가스가 발생되며 연탄가스 사고의 원인이 된다. 석탄의 분류는 무연탄, 유연탄, 갈탄, 토탄 등이 있으며, 생성 순서는 토탄→갈탄→역청탄→무연탄이다.","無煙炭, Anthracite"
303,무연화약,"니트로셀룰로오스를 주성분으로 하는 니트로셀룰로오스 화약과 니트로셀룰로오스에 니트로글리세린을 배합한 니트로글리세린 화약으로 나눌수 있다. 니트로셀룰로오스 화약에는 β-화약과 피로콜로디온(pyrocollodion)화약이 있으며, 니트로글리세린 화약에는 가루형, 구형, 관형 등이 있고, 주로 탄환의 발사약으로 사용되나 로켓 발사약으로 사용되기도 한다. 또, 질소의 함유량에 따라 강면 화약(N=13% 이상)과 약면 화약(N=12% 이하)으로 구분하기도 한다. 발화온도는 약 180℃정도이며, 건조 상태에서 자연 폭발의 위험이 있으므로, 운반이나 취급 및 저장등에 많은 주의를 기울여야 한다.",無煙火藥
304,무용제화약,니트로글리세린 화약.,
305,무지지상향계단식채굴법,"작업 개소를 많이 만들기 위하여 채굴면을 계단식으로 만들어 상부로 채굴을 진행시키는 채굴법이다. 이 채광법의 적용 조건은 광맥의 경사가 급경사이고, 폭이 별로 넓지 않은 광체에 해당한다. 이 채광법의 장점은, 동시에 많은 작업장을 만들어 다수의 착암기를 사용할 수가 있고, 채굴 도중 필요하면 언제든지 다른 채광법으로 바꿀 수 있다는 점 등을 들 수 있다.",
306,무지지채굴법,"상반이나 좌우의 축벽을 지지하지 않아도 붕락되지 않을 정도의 견고한 모암과 광석일 때 적용되는 채광법으로서, 채굴 후에 생긴 공동을 충전물이나 지주 등으로 지지하지 않고 그대로 방치하면서 채굴해 나가는 방법이다. 그러나, 광체가 커서 상반을 지지할 목적으로 광주를 남겨 놓거나, 급경사 광체에서 작업을 하기 위한 발판을 걸쳐 놓은 것 등은 무지지 채굴법에 속한다. 이 무지지 채굴법의 종류에는 무지지 상향, 계단식 채굴법, 무지지 하향 계단식 채굴법, 중단 계단식 채굴법, 갱내 갱정법, 잔주식 채굴법 및 시링키지(shrikage)채광법 등이 있다.","無支持採掘法,open stope mining method"
307,무지지하향계단식채굴법,"대체로 무지지 상향계단식채굴법과 같으나, 다만 진행 방향이 하부로 향한다는 것이 다르다. 따라서, 무지지 상향 계단식 채굴법과 같이 광맥을 천반으로 하여, 착암기를 상부로 향하고 천공하는 대신 바닥 쪽을 향하여 천공하게 되므로 작업이 안전하고, 작업대를 설치할 필요가 없다는 등의 장점이 있으나, 광석 운반이나 배수에 기계력을 이용해야 된다는 장점이 있다.",
308,물리검층,"지층의 물리적 양을 심도의 함수로 하여 기록하는 검층 방법으로 전기검층, 방사능층, 온도검층 등의 총칭이다.","物理檢層, Geophysical well logging"
309,물리탐광,"전기, 자기, 지진, 중력 탐광이 물리탐광에 속한다.",物理探鑛
310,물의윤회,"지표와 바다로부터 증발하여 대기내의 수증기 상태로 존재하였다가 비나 눈으로 강수 하고 있다. 이 과정을 반복 하는데, 이것을 물의 윤회라고 한다.",
311,미광,선광 작업에서 유용 성분이 없어서 필요가 없는 광석이다. 정광만 회수하고 나머지는 찌꺼기이다,
312,미네랄지그,지그의 한 종류로서 비중을 선별해 내는 기계이다.,
313,미분리입자,단체 분리가 완전히 된 입자.,locked particle
314,미시간심빼기,"갱도 중심 부분에 큰 지름의 천공(최대 101.6㎜)을 하지만, 이 구멍에는 장약을 하지 않고 그 주위에 작은 구멍을 천공하여 장약을 한 후 발파하는 방법이다. 이 방법은 천공이 쉽고, 1발파당 굴진 길이가 늘고, 심빼기에서 비석이 적다는 장점이 있는 반면에, 튼 구멍을 천공해야 하고, 폭약 소비량이 많아지는 경향이 있다.",Michigan cut
315,밀리세컨드발파법,지발발파법의 하나로서 폭발지연 시간의 차이에 따라 분류된다. 발파시간은 0.020-0.050초 간격으로 폭약을 폭발시키는 방법이다.,"millisecond,MS"
316,밀의 임계속도,"볼과 밀의 안벽 사이에 미끄러짐이 없다고 가정하고, 밀의 회전 속도를 점차 빠르게 하면 볼의 무게와 원심력이 균형을 취하는 회전 속도에 달한다. 이때의 속도를 밀의 임계속도라 한다.",
317,바다골재,"해저나 해변에 퇴적되어 있는 바다모래, 바다자갈, 하구에 퇴적되어 있는 하구모래, 사구에 퇴적되어 있는 사구모래를 말한다.",骨材
318,바리스타이트,"약 50%의 니트로글리세린이 배합되어 폭발 온도가 높은 화약으로서, 현재는 전혀 사용하지 않고 있다.",
319,바움지그,"일종의 지그로서, 그 구조는 수선실과 공기실로 나누어져 있고, 수선실에는 수평 또는 구멍이 뚫린 경사 철판이 놓여 있어 석탄과 버력이 이 위에서 분리된다. 이 공기실은 폐쇄되어 있고, 여기서 압축 공기에 의한 물의 상하 운동이 일어난다. 수선실과 공기실과의 벽은 철판보다 어느 정도 깊게 빠져 있다. 물통, 즉 물 탱크는 보통 길이 방향으로 몇 개의 구로 분할된다. 공기실 위에는 공기 밸브가 있어 물의 맥동을 일으키는 압축공기를 넣거나 배출시킨다. 망상의 구멍을 빠져 나와 허치(hutch)에 가라앉은 버력과, 버력 배출기로 배출된 굵은 버력은 버킷 엘리베이터로 탈수되면서 배출된다.",
320,반사법,"땅 속에 있는 서로 다른 지층의 경계에서 반사되어 나온 탄성파를 기록해서 지하 구조를 알아 내는 방법이며, 이 방법의 특징은 짧은 축선으로 깊은 곳까지 탐사할 수 있다는 것과 불연속면이 많아도 이것을 쉽게 알아볼 수 있게 할 수 있다는 점이다. 기계가 복잡할 뿐만 아니라 조사를 하는 데 고도의 기술이 필요하나 최근에는 이 반사법에 사용되는 기계가 매우 발달되었으며 자기 녹음 방식에 의한 탐광기와 해석용 재생기(解析用 再生機)가 있다. 자기 녹음 방식에 의한 발달은 종전의 단점을 개량하여 모든 정보를 일단 테이프에 녹음해 몇번이고 재생 가능한 상태로 기록할 수 있게 하는 데 성공하였다. 그러므로, 지진파 탐광 중에 수록한 정보가 빠짐없이 이용됨은 물론 해석용 재생기를 이용하여 새로운 자료를 가지고 탐사 결과를 처리하는 방식이 개발 연구되었다. 현재 반사법으로 얻을 수 있는 유효한 정보는 반사파의 검출뿐만 아니라 이의 연결법, 소멸 상태의 파형, 주기 등과 또한 단층 판정에 사용되는 회절파, 속도 분포에 이용할 수 있는 다중 반사, 표면파 등의 파동 등이 있다. 이것들은 단층이나 반사면의 암상변화, 반사층의 호층상태(互層狀態) 등을 어느 정도 반영하는 것이다. 종전의 지진 탐광에 있어서는 100싸이클 이하의 주기적인 지진파가 쓰였으나, 최근에는 고주파의 파장을 이용하며 미세한 지하 구조까지 탐사하는 방법이 많이 쓰이고 있다. 또한 해상에서는 지진 탐광의 반사법과 유사한 원리에 따라 진원을 화약 대신 압축 공기 또는 가스 폭발 등의 음파를 발생시켜 탐사하는 해상 음파 탐광이 개발되었다.",
321,반사현미경,편광 현미경의 일종으로 불투명 광물의 반사광에 의해 결정의 광학적 성질을 조사하는 현미경. 광석 현미경이라고도 한다.,"反射顯微鏡, refletion microscope"
322,반산화배소,"광석 또는 정과 중의 S의 일부를 산화해서 제거하는 경우를 말한다. 동 제련의 배소 등은 이 예로, 만들려고 하는 매트의 품위에 따라 S을 남긴다.",
323,반알렌데,"외기권, 즉 기권의 바깥부분이다. 대전 입자가 지구 지상으로 인하여 대략 도우넛 모양으로 지구를 둘러싸고 있다.",
324,반압,"반압과 지압은 엄밀히 정의할 때에는 구분이 되나 광산에서는 같은 뜻으로 사용된다. 즉 지압은, 지하에 미치는 넓은 의미의 반압 상태를 말하는 것이고, 반압은 지하에 공동이나 갱도를 개설했을 때 미치는 압력 상태를 뜻한다.",
