연번,용어명,용어설명,유사용어
1,가공삭도,"가공삭도는 단선식과 복선식이 있다. 단선식은 양쪽에 있는 드럼에 연결된 메인(main)로우프가 연속적으로 같은 방향으로 움직이게 되어 있고, 이 로우프 위에 캐리어를 달아 광석을 운반하는 방향에는 광석이 담긴 캐리어를 매달고, 반면 빈 캐리어는 반대 방향에 걸게 되어 있다. 복선식은 움직이지 않는 굵은 로우프 위에 도르래가 달린 캐리어를 달고, 그 밑에 이 캐리어를 잡아당기는 가는 로우프에 의하여 가동시키게 되어 있다. 단선식은 시간당 운반 능력이 약20톤 정도이지만 복선식은 200톤 까지도 처리할 수 있기 때문에, 운반해야 할 양이 많으면 복선식으로 하는 것이 좋다. ① 단선식 : 한 개의 와이어로프를 고리 모양으로 하여 운반기를 이것에 고정시키고, 와이어로프를 순환 또는 왕복시키는 방식이며, 스키장의 리프트는 이 방식에 속하는 것이 많다. ② 복선식 : 강력한 지지삭(支持索)을 팽팽하게 쳐놓고, 이 지지삭에 도르래[滑車]를 통해 운반기를 매달고, 따로 고리 모양의 예인삭을 운반기에 장치하여, 이 예인삭을 왕복 또는 순환시켜서 운반기를 이동시키는 방식이다. ③ 3선식 : 복선식의 예인삭을 2개로 한 것, 또는 하나의 예비 예인삭이 있는 것으로서, 그만큼 안전성이 높다. ④ 4선식 : 지지용 로프가 2개, 예인삭이 2개 있는 것으로, 거의 사용되지 않는다. 가공삭도의 지주(支柱)와 지주 사이의 거리(지주간 거리)는 600∼1,000 m의 것이 많으나, 목재운반용에는 중간에 지주를 많이 세워서 전장 5km를 넘는 것도 있다. 가공삭도에 사용되는 와이어로프의 굵기는 지주간 거리나 하물의 무게에 따라 다르지만, 비교적 중량물을 운반하는 임업용은 지름 18~34mm의 강철삭이 사용된다. 와이어로프는 운반중에 일어나는 충격이나 마모에 의해서 절단되지 않도록 안전도를 충분히 고려해야 한다. 가공삭도에는 전용삭도(專用索道)와 영업용 삭도가 있으며, 전용삭도에는 광산용·임업용·공장구내용·재탄(載炭) 및 저탄용·토목건축공사용·선박용·군사용 등이 있고, 영업용 삭도는 일정한 요금을 받고 화물이나 여객을 운반하는 것이다. 가공삭도의 설치 및 운영은 1977년 12월 31일 공포된 삭도·궤도법의 규정에 따라야 한다.","架空索道,aerial cableway"
2,가공선식전기기관차,"광산에서 사용되고 있는 기관차의 한 종류이다. 가공선식전기기관차는 운행비가 가장 싸고, 효율이크며, 고장률이 작아 주 운반갱도에서 가장 많이 사용된다. 무게는 5-10톤이 대부분이다.",架空線式電氣機關車
3,가도,"탄을 캐낸 자리, 즉 탄을 캐낸 길로서, 특히 천장이 내려앉기 쉽고 갑작스레 하중을 받을 수 있는 위험한 곳이다.",Gate road
4,가동연인원,1년간 전 종업원이 실제로 작업한 가동공수의 총합계를 말함.,可動延人員
5,가동조오,광석을 파쇄하는 브레이크형 조오 크러셔 기계부분에서 고정조오(fixed jaw)와 조화를 이루어 광석을 파쇄하는 부분.,Movable jaw
6,가루다이너마이트,"NG(니트로 글리세린)의 함유량이 작아 교질화되지 않은 가루 상태의 폭약으로, 흡수성이 크며, 젤라틴 다이너마이트보다 둔감하다. 이것은 메탄가스 또는 석탄 미립자에 대한 안전도가 높기 때문에, 탄광에서 채탄용으로 많이 사용되고 있다. 포장은 종이봉투에 넣어서 파라핀 방습 가공을 하고, 5-10개를 포장하여 포장전체를 방습 가공한다.",Powdery dynamite
7,가솔린기관차,디젤기관차와 함께 내연 기관차로 분류된다. 연기와 가스가 배출되어 갱내에서보다 갱 밖에서 주로 사용된다.,機關車
8,가스압,"발파에 있어 폭파에 의한 파괴도 있지만 고압의 가스압에 의해서도 파괴된다. 즉 고압의 가스압은 암반에 응력을 증가하게 하며, 이 응력은 응력파와 간섭하여 암석을 파괴하는 것이다.",
9,가스폭발,"가연성가스가 폭발하는 것으로 주로 메탄가스 폭발을 말하며, 메탄가스가 공기 중에 9.5%일 때 폭발이 가장 심하게 일어난다.",Gas explosion
10,가연성가스,"석탄 광산의 갱내에는 메탄가스와 수소 등의 가연성가스가 발생하며, 채탄 작업을 할 때 석탄가루가 공기 중에 떠올라 섞이면서 불꽃과 접촉하게 되면 탄진 폭발을 일으키게 된다.",가연성가스
11,가용매장량,채탄·채석이 가능하고 원석 제품으로 생산할 수 있는 매장량을 말한다.,可用埋藏量
12,가우스,"기호 G. 독일의 수학자이며 전자기학의 발전에 공헌이 큰 K.F. 가우스의 이름을 딴 것이다. 1Mx(맥스웰)의 자기력선속이 1cm2의 넓이를 통과할 때의 자기력선속밀도와 같다. 흔히 자기장의 세기의 단위 Oe(에르스텟)과 혼용되는데, 진공 속에서는 자기력선속밀도가 1G일 때 자기장의 세기는 1Oe이라는 관계가 있다. 1G=10-4T(테슬라)이며, 자기력선속밀도의 MKSA단위인Wb/m2 (웨버매제곱미터)와의 관계는 1G=10-4 Wb/m2이다.",Gauss
13,가이거 뮐러 계수기,가이거 계수기보다 한 단계 앞선 카운터로서 방사능 원소를 함유한 광물을 쉽게 탐지한다.,Geiger Muller counter
14,가이거계수기,방사능 탐광에 사용되는 방사능 측정 조사용구.,Geiger counter
15,가이드,갱도 굴착시 키블을 올릴 때 그대로 올리면 옆으로 흔들려 갱내에 있는 지주와 맞닿는 위험이 있으므로 두가닥으로 된 가이드줄(Guide line)을 달아 놓는다.,Guide
16,가채광량,매장광량 중 채광할 수 있는 광석의 중량을 말한다.,"可採鑛量,Minableore"
17,가채원광량,채광에 의해 출광되는 원광의 중량 즉 가채광량과 혼입되는 폐석과의 합계를 말한다.,"可採原鑛量,Minable crudeore"
18,가채율,매장량에 대해 채광할 수 있는 광량의 비율을 말한다.,"可採率,Mining recovery"
19,가채품위,가채광량에 대응하는 품위를 말한다.,"可採品位,Grade of minable"
20,가행가치평가,석탄생산에 있어 직결되는 직접비용 부분의 생산성지표(채탄 능율)와 수입에 변화를 주는 상품의 질(탄질)을 공식화하여 구역별 가행가치를 상대적으로 평가하는 것이다. 산출식은｛채탄능률×(원탄질+선탄향상치)｝/300 이다.,稼行價値評價
21,가행년수,"매장된 광물을 채취하는데 소요되는 연수를 말하며, 매장량, 채취량, 운반량, 판매량, 설비 등 여러 조건에 의해 변동되는 가변성이 있다. 가행년수=총생산량/개발부존면적 또는 개발편수×개발가능 부존면적 또는 개발 가능편수 연생산규모",加行年數
22,가행채굴폭,가행탄층 중에 있는 석탄부의 두께를 말한다.,"稼行採掘幅,Working thickness of coal seam"
23,가행탄층폭,가행탄층 중에 있는 석탄부의 두께를 말한다.,"稼行炭層幅,Working thickness of coal in coal"
24,각주,기둥의 다른말. 특히 네모난 기둥을 말함.,角柱
25,간접부,"직접부를 지원 또는 보조하는 작업원으로 기계, 전기, 운반등에 종사하는 작업원을 말한다.",間接夫
26,갈탄,"6300BTU/1b 이하의 탄. 석탄을 그 형성 과정에 의해 분류할 때 이탄과 아역청탄 사이에 해당된다. 경상북도 영일지역 제3기 지층에는 약간의 갈탄이 부존되어있으나 생산은 하지 않고 있다. lignite은 동의의. 탄소의 양이 적고 갈색을 띄고 있어 갈탄이라 부른다. 생성당시의 식물구조가 보이는 것이 있으며, 탈 때 냄새가 심하고 연기가 많이 나며 주로 연료용으로 사용한다.","褐炭, Brown coal"
27,감마(γ)선,"원자가 분열할 때 방출되는 입자와 전자파로서 알파(α), 베타(β), 그리고 감마선(γ)으로 구성되어 있다. 이 중 감마선은 전자파의 일종이다.",
28,감열소염제,"가스의 연쇄 반응을 늦추거나 방지하기 위해 사용한다. 연소할 때 반응열을 낮추고, 불꽃을 줄이는 효과가 있으며, 감열소염제로는 염화나트륨이 많이 사용되고 있다.",感熱疏髥制
29,갑종탄광,광산 보안상 광산을 구분하여 일반 광산과 석탄 광산으로 하고 석탄광산은 이를 다시 갑종 탄광과 을종 탄광으로 구분한다. (가) 주요 배기 정도의 기류중에 가스 함유물이 0.25%이상. (나) 채탄 작업의 기류중에 가연성 가스 함유물이 1%이상일 것. (다) 통기시설의 운전을 1시간 정지할 경우 함유율이 3%이상의 가연성 가스가 통행 갱도 또는 채탄 작업장에서 검출된 것.,甲種炭鑛
30,강도율,재해자로 인하여 발생한 작업 손실일수를 가동연시간으로 환산한 재해율을 말한다. 강도율=손실일수/가동연시간×103,强度率
31,강면화약,1845년에 발명되었다. 질소의 함유량에 따라 강면화약 (N=13%이상)과 약면화약(N=12%이상)으로 구분한다.,강면火藥
32,강성철재지보,"지보가 받는 반압을 표준으로 한 분류법에는 강성 지보와 가축성 지보가 있는데, 강성 지보는 구조가 견고하고 압축 작용을 하지 않는 지보이며, 암반을 지지함으로써 암반의 움직임을 직접 막도록 되어 있다. 따라서, 반압이 작을 때에는 이 지보로 지지되어 암석은 움직이지 않고, 갱도도 당초의 형상대로 유지된다.",强性鐵材支保
33,강자성물질,"니켈, 코발트, 자철광과 같이 자장으로부터 밖으로 내어 놓아도 오랫동안 자성을 잃지 않는 물질을 말한다. 강자성은 자성이 강한 것으로서, 이것을 이용하여 광물을 충분히 선별할 수 있다.",强磁性物質
34,개갱,"지하에 매장되어 있는 광석이나 석탄을 채굴하려면 지표에다 갱구를 설치하고, 이 갱구로부터 직접 광석을 채광하는 막장까지 갱도를 시설해야 한다. 이 갱도가 있어야만 사람이 통행할 수 있고, 여러 가지 자재와 채굴한 광석을 운반할 수 있으며, 갱내에서 필요한 신선한 공기를 들여보낼 수도 있기 때문이다. 개갱은 이와 같은 목적으로 갱구로부터 막장까지에 이르는 여러 가지 갱도를 계획하고 굴진하는 것을 말하며, 광산 개발에 있어 서 매우 중요한 작업 과정이라 할 수 있다.",開坑
35,개갱계수,"광산의 개갱계획에 있어서 암석갱도의 굴착이 생산계획에서 어느 정도인가를 표시하는 지표로, 갱도연장으로 표시하는 방법(m/1000톤)과 굴착량으로 표시하는 방법(m3/1000톤)이 있다.","開坑計數,Development factor"
36,개발가능성조사,기초조사후 부존 광물에 대하여 규모와 품위 등 개발 경제성을 파악하기 위한 조사를 말한다.,開發可能性調査
37,갱구,"지표에서 갱도로 들어가는 입구. 갱도가 수평갱(水平坑)인가 사갱(斜坑)인가 또는 수갱(竪坑)인가에 따라 각각 통동(通洞)갱구 ·사(斜)갱구 ·수(竪)갱구라 한다. 이 곳은 갱내에서 채굴된 광석 ·석탄을 반출하거나 갱내에 항상 신선한 공기를 공급하는 통로가 된다. 2개 이상의 갱구가 있어서, 한쪽 갱구는 입기(入氣)갱구로, 다른 쪽은 배기(排氣)갱구의 역할을 한다.","坑口,pit mouth"
38,갱내갱정법,"무지지 채굴법의 하나로서 광석과 모암이 견고하고 큰 괴상의 광체에 적용된다. 채굴 방법은 하부 갱도로부터 광체 내에 수직 또는 경사되게 레이즈를 굴진하여 이를 갱정으로 하고, 상부에서 사방으로 수평 채굴을 하는 동시에 하향 계단식 채굴법과 같이 하부로 진행해 가는 채굴 방법이다.",坑內坑井法
39,갱내근로,"광산, 굴, 터널 등의 지하작업을 말하며, 갱내작업에 종사하는 근로자를 일반적으로 갱내공 또는 갱내부라고 일컫는다. 이 갱내작업에는 굴삭굴진, 채굴, 지보공, 발파, 운반, 충전, 배수 등의 종류가 있다. 갱내 작업은 갱외작업에 비하여 육체적·정신적으로 중노동이기 때문에 근로기준법은 여 자와 18세 미만 자의 갱내작업을 금지시키고 있다.(근로기준법 제70조)",坑內勤勞
40,갱내분진,"광산 ·탄광의 갱내에서 채굴, 갱도의 굴진(掘進), 운반 기타 작업에 수반하여 발생하는 분진.갱내분진 중의 주된 것은 탄진 (炭塵)과 암석분진이다. 탄진은 주로 석탄의 채굴, 연층갱도(沿層坑道)의 굴진, 석탄의 적재 ·운반 도중에 바꾸어 싣기 등에서 발생한다. 탄진은 갱내기류 중에 떠다니거나 또는 갱도 안에 쌓여서 폭발 및 폭발의 전파에 관계한다. 암석분진은 광석의 채굴, 암석갱도의 굴진 같은 작업에 수반하여 발생하고, 공기 속에 부유한다. 이러한 분진은 광물 ·암석 ·석탄 등이 미세하게 분쇄되어 생긴 미립자로서, 크기는 1μm 이하~수십 μm까지 광범위하다. 발생하는 분진의 양, 기류 중에 떠도는 분진의 농도는 작업의 종류 ·지속시간, 공기의 유입량 ·속도, 암석 ·석탄의 성질 등에 따라 다르다. 부유분진 중의 규산질(硅酸質) 분진은 호흡기관을 침범하여 규폐증(硅肺症)을 일으키기도 한다. 탄진 발생 방지에 쓰이는 방법은 탄진 발생장소에 분수막을 만들거나, 탄진이 적재된 장소에 물을 뿌리든가, 또는 채탄에 들어가기 전에 탄층 내에 압력수를 주입하여 석탄을 적시는 탄벽주수법 등의 방법이 이용된다. 암석분진 방지책은 착암기에 물을 통하게 한 습식으로 발생한 분진을 적셔서 부유하지 못하게 하거나, 그대로 흘려보내는 습식착암법이 일반적으로 이용된다. 그 외에 발파작업 중에 발생하는 분진을 막기 위해 분진이 날아가는 방향에 분수막(噴水幕)을 치는 방법, 집진기(集塵器)로 분진을 흡수하는 방법, 작업자에게 분진마스크를 착용시키는 방법 등이 있다.","坑內粉塵,mine dust"
41,갱내수,"갱 안에 물이 생기는 원인은 첫째, 지하수가 단층이나 균열을 따라 갱 안으로 출수 되는 경우와, 둘째, 지표의 하천수나 빗물이 지하 채굴로 인하여 생긴 암반의 균열이나 채굴적을 따라 갱안으로 침수되는 경우이고, 셋째, 폐갱도나 채굴된 공동에 고여 있던 물이 하부 채굴 때에 갑자기 출수되는 경우 등으로서, 이와 같은 갱내 출수를 그대로 방치할 수는 없다. 그러므로, 갱 안에서 갱 밖으로 퍼내야 하며, 이 갱내수의 배출 작업을 배수라 한다.",坑內水
42,갱내운반,"광산 ·탄광의 막장이나 기타 작업장에서 광석 ·폐석 ·필요 자재 등을 갱구 또는 반대 방향으로 운반하는 것을 말한다. 넓은 뜻으로는 갱내외로의 승강을 위한 인원의 수송도 포함된다. 수평갱도의 기관차 운반, 엔드리스 운반, 사갱의 코스 권양운반(捲揚運搬), 스킵 권양운반, 수갱(竪坑)의 케이지 권양운반 등이 있다.","坑內運搬,underground transportation"
43,갱내조명,"광산의 갱내 작업장은 항상 어둡기 때문에 충분한 조명이 되지 않으면 사고가 일어나기 쉬울 뿐 아니라, 종업원의 시신경이 피로하게 되는 등 신체상으로도 많은 장애를 일으키게 된다. 휴대용에는 아세틸렌등과 전기 안전등이 사용되고, 고정용으로는 전등이 사용된다. 아세틸렌등은 전기 안전등에 비하면 조도와 광도가 나쁘고 사용상 불편하나, 값이 싸기 때문에 금속 광산이나 석탄광 이외의 비금속 광산에서 많이 사용하고 있지만, 석탄광에서는 갱내의 폭발성 가스 때문에 이의 사용을 금지하고 있다.",坑內照明
44,갱내지질도,갱내에 있어서 지질 상황을 표시하는 그림을 말한다.,"坑內地質圖,Underground geological map"
45,갱내채굴,"갱도를 뚫고 들어가 지하의 광상 ·탄층에 도달하여 광석 ·석탄 을 채굴하는 일.노천채굴(露天採掘)에 대응하는 말이다. 자원이 풍부하고 입지조건이 좋은 오스트레일리아와 같은 나라에는 작업하기 쉽고 비용이 적게 드는 노천굴 광산이 많지만, 한국에서는 석회석 ·쇄석(碎石) 채굴의 경우를 제외하고 노천채굴에 적합한 광상 ·탄층이 거의 없어 대부분이 갱내채굴 방식을 채택하고 있다. 갱내채굴의 장점은, ① 표토층이 두꺼워 노천채굴로 채산이 맞지 않는 광상이라도 유리하게 채굴할 수 있 고, ② 광맥이 가늘거나 불규칙한 광체(鑛體)에서도 채굴이 가 능하고, ③ 채굴가능 심도가 깊고(현재 세계에서 가장 깊은 갱 내막장은 지표면에서 수직으로 약 3,000m), ④ 한설 ·풍설 등 의 기후나 일기의 영향을 거의 받지 않으며, ⑤ 연중 고르게 조 업할 수 있다는 점 등이다. 막장 채굴방법은 탄광에서 장벽식(長 壁式) 채탄법, 금속광산에서 충전(充塡)채광법 ·슈링케이지법 (shrinkage stopping) ·공동법(空洞法) ·중단(中段)채광법 · 케이빙법 등이 있다. 갱내화재(坑內火災, mine fire)는 갱내에서의 나화, 끽연, 용접, 발파, 기기의 파열 및 마찰, 전기, 자연발화, 가스 및 탄진 폭발등의 화원을 인하여 발생하는 화재를 말한다.","坑內採掘, underground mining"
46,갱내화재,"갱내에서의 나화, 끽연, 용접, 발파, 기기의 파열 및 마찰, 전기, 자연발화, 가스 및 탄진 폭발등의 화원으로 인하여 발생하는 화재를 말한다.","坑內火災, mine fire"
47,갱도,"광산 ·탄광 또는 토목공사를 위하여 지하에 뚫어놓은 길. 지하에 부존하는 광상(鑛床) ·탄층에 이르러 그것을 채취하기 위해서나, 지하발전소(한국은 1980년 완공된 청평 양수발전소 등)의 건설을 위해 건설 지점에 이르기 위해서는 갱도가 필요하 다. 수직으로 파내려간 것을 수직갱 또는 수갱(竪坑)이라 하고, 경사지게 파내려간 것을 사갱(斜坑), 수평적인 것을 수평갱이라 한다. 광산에서는 갱외에서 직접 광상 ·탄층에 이르는 주요 갱도를 통동(通洞)이라고도 한다. 갱도는 목적 ·위치 ·크기 등에 따라 다양한 이름이 있다. 목적에 따라 탐광(探鑛)갱도 ·탐탄(探炭)갱도 ·채굴갱도 ·운반사갱 등이 있다. 위치 ·지명에 따라서 중앙수갱 ·350m 갱도 등이 있으며, 크기에 따라서는 대 수갱(大竪坑) ·복선갱도 등이 있다. 지하발전소 등에서도 목적 과 용도에 따라 주터널 ·케이블 터널(cable tunnel) 등의 이름을 붙인다. 크기는 단면적 4m2 정도에서부터 수백 t의 광석이나 석탄을 적재한 화물열차가 왕복하며 형광등(螢光燈)이 콘크리트 갱도벽을 조명하고 있는 대규모의 것 등 여러 가지가 있다.","坑道,mine shaft"
48,"갱도탐사(坑道探査,Tunnel pr-","수직, 수평 또는 경사진 갱도로 실시되며, 광맥에 대하여 나란히 또는 직각으로 시행한다.갱도로 굴진하는 탐사에 대하여 시추가 경제적이고 신속하기 때문에 흔히 시추 작업으로 땅 속의 광석이나 암석 상태를 알아보는 것이 일반적인 방법이다.","坑道探査,Tunnel pr-"
49,갱부,"광산 ·탄광 ·석유 광업소 등에서 관리직과 사무직원 등을 제외한 일반 노무자.갱부 중 갱내작업을 하는 사람을 갱내부라 하며 주된 직종은 직접채광 또는 채탄작업을 하는 채광(채탄)부, 광석 ·석탄 ·폐석(廢石) 등을 운반하는 운반부, 갱도(坑道)의 굴진 ·수리 등을 하는 굴진부, 지보작업(支保作業)을 하는 지주부(支柱夫), 기계류 ·전기계통의 보수유지를 담당하는 기계공 ·전기공 등이다. 갱외(坑外)작업을 하는 사람을 갱외부라 하며 운반부 ·선광(선탄)부, 기계 공장에서 일하는 기계공 ·전기공 등이 이에 속한다.","坑夫,miner"
50,갱외운반,"광산의 갱 밖 구내에서의 운반은 갱 안에서 운반된 광차나 벨트가 그대로 선광장까지 연장 운행되도록 되어 있으며, 선광장의 저광장에서 역에 마련된 저광장까지는 주로 자동차에 의하여 정광이나 석탄을 운반한다. 그러나, 운반해야 할 양이 적당하고 도로를 가설할 수가 없는 산간에서는 가공 삭도를 설치하게 된다. ""갱내운반"" 참고.",坑外運搬
51,건식,"착암기로서 천공하는 도중에 구멍 속에 생긴 돌가루를 배출시키는 방법에는 구멍 속에 물을 보내 주는 방법과, 공기를 불어 넣어 주는 방법이 있다.앞의 방법이 습식이며, 뒤의 방법이 건식이다. 대형의 천공기는 습식을 많이 사용한다.",乾式
52,건식선별,"비중 선별에서 물을 쓸 경우 습식 선별이라 하고, 공기를 이용할 때를 건식 선별이라 한다.",乾式選別
53,검탄,"목탄의 하나인 참숯. 백탄(白炭)에 비하여 굳기 ·연소 지속시간은 떨어지나, 발화점 이 250~400℃로 순간적인 화력은 강하다. 발열량은7,000~8,000cal/g이다. 대부분이 난방용 ·취사용 ·건조용 연료에 사용되었으나 이제는 거의 쓰지 않는다. 제탄공정 중 정련(精練) 때 최고 700℃ 정도에서 멎게 하고, 숯가마의 입구와 굴뚝을 막고 숯가마 안에서 소화(消火) ·냉각하면 얻어진다.","黔炭, charcoal"
54,게르마늄,"주기율표 제4B족에 속하는 탄소족원소. 원소기호 : Ge 원자번호 : 32 원자량 : 72.59 녹는점 : 958.5℃ 끓는점 : 2700℃ 비중 : 5.325(25℃) 1871년 D.I.멘델레예프가 에카 규소(珪素)로서 그 존재를 예언하 였으며, 86년에 독일의 화학자 C.빙클러, A.브라이하우프트가 아지로다이트(argyrodite) 속에서 발견하여, 독일의 라틴명인 Germania를 따서 게르마늄이라 명명하였다. 아지로다이트 ·게 르마나이트 등의 광석이 있으나 극히 드물다. 지각 속에는 넓고 얇게 분포되어 섬아연석(閃亞鉛石) ·황화동석 속에 약간 함유 되어 있고, 또 암석 속에서 규산염의 규소와 치환하여 미량(微 量)이 함유되어 있는데, 이 때문에 클라크수는 0.00065로 제43위 이다. 석탄 속에도 농축되어 존재하며, 식물에 흡수되어 존재하 는 경우도 많다. 【성질】 청색이 감도는 회백색의 단단한 금속으로 굳기는 불순 물에 따라 뚜렷한 차이가 나지만, 보통은 모스굳기로 6이다. 전 형적인 반도체로, 진성(眞性)반도체로 생각된다. 3가 또는 5가의 불순물 원자를 미량 함유할 때는 각각 p형 및 n형 반도체가 된다. 결정구조는 다이아몬드형이다. 공기 중에서는 안정하지만, 적열(赤熱) 이상으로 가열하면 산화 한다. 염산 ·묽은 황산에는 녹지 않지만, 왕수(王水) ·알칼리 용액(과산화수소 함유) 및 뜨거운 진한 황산 등에는 녹는다. 흔 히 2가 및 4가의 화합물을 만든다.",Germanium : Ge
55,경사습곡,"습곡축면(褶曲軸面)이 어떤 각도로 기울어진 습곡. 지층이 옆으로부터 압력을 받아 휘어질 때 한 방향의 압력이 상 대적으로 강하여 습곡축면이 기울어져 생긴다. 한편 대칭적으로 휜 지층의 습곡부에는 하나의 대칭축면을 기준으로 습곡축면이 있는데, 옆으로부터 받는 압력이 좌우균등인 경우 습곡축면은 수 직이 된다.",傾斜褶曲 inclined fold
56,경상누층군,"한국 남부의 대구·경주 지방에 잘 발달한 중생대 백악기의 지층.경상계라고도 한다. 경상누층군은 검은색 또는 붉은색의 역암 (礫岩)·사암·셰일 등이 두껍게 퇴적한 지층이며, 선캄브리아대 부터 중생대 초의 지층인 대동계(大同系)를 뚜렷한 부정합(不整 合)으로 덮고 있다. 이 계는 하부인 낙동통(洛東統)과 상부인 신 라통(新羅統)으로 나뉜다. 낙동통은 일부 지층을 제외하면 붉은색 셰일·사암·역암의 호층(互層)으로 되어 있고, 때로는 무연탄층이 협재(狹在)하며, 두께 약 4,000 m이다. 한편 신라통은 그 하부에 집괴암(集塊岩)과 붉은색 셰일·사암·역암으로 구성되어 있고, 두께는 약 3,600m이다. 신라통은 낙동통을 평행부정합으로 덮었으며, 널리 다른 지역에서도 다른 지층을 부정합으 로 덮는다.낙동통에서는 비해성패(非海成貝)의 화석 외에 Euestfheria류의 새우 화석이 산출되고, 신라통에 서는 쌍떡잎식물의 화석식물군 및 Trigonoides 등의 패류 화석 군이 산출된다.",慶尙漏層群
57,경상자,재해로 인한 부상정도가 3일 이상 4주미만의 치료를 요하게 된 자를 말한다.,輕傷者
