연번,용어명,용어설명,유사용어
628,아탄,"갈탄 중에서 특히 목질 조직이 많이 남아 있는 석탄화도가 낮은 탄질물을 말한다. 학술적으로는 갈색갈탄(褐色褐炭)이라고 한다. 목질조직이 어느 정도 보존되어 있어서 나뭇결이 눈에 보이는 목질아탄(木質亞炭)과 수지립(樹脂粒) ·각피(角皮) ·화분포자류(花粉胞子類) ·부후균류(腐朽菌類), 그 밖에 미세한 석탄질과 광물질로 된 치밀한 탄질아탄(炭質亞炭)의 두 종류가 있다. 다량의 수분이 건조할 때에 수축하여 목질아탄은 널빤지 모양으로 벗겨지고, 탄질아탄은 불규칙한 균열이 생겨서 급속히 분화(粉化)한다. 3,000∼4,000kcal/kg의 발열량이 낮은 비점결탄(非粘結炭)으로, 일부 지방에서 연료로 사용된다.","亞炭, Lignite"
629,아프터쿠울러,냉각장치의 하나로서 압축기 배출구에 중간 냉각기와 같은 구조를 가지고 있다. 결국 공기의 냉각을 꾀하기 위한 장치이다.,
630,안전등,갱내 작업원의 작업시 착용하는 필수용품이며 연축전지를 전원으로 사용하는 모자용 등을 말한다.,安全燈
631,안정도,"화약류가 스스로 분해되는데 대하여 저항하는 정도. 자연 분해는 온도가 증가함에 따라 촉진되어, 니트로셀룰로오스나 니트로글리세린 등의 화약류가 분해할 때 45-125℃사이에서는 온도가 50℃씩 증가할 때마다 분해율이 1.5-2.2배 빨라진다.",安定度
632,안정도시험,"일정한 양의 화약류를 일정 온도로 가열 했을 때 나타나는 변화 상태를 조사하는 시험으로, 시험 방법에는 유리산 시험, 가열 시험, 내열 시험 등이 있다.",安定度試驗
633,안티몬,"금속 안티몬은 납 또는 다른 금속과의 합금 재료로서 인쇄용 활자, 땜납, 통신 장비의 부품 재료, 또는 축전지의 전지판 등으로 사용되며, 화학 공업용으로는 산화물로 만들어 이용하는데 주로 고무, 플라스틱의 경화제, 유리 착색제, 탄약 등에 쓰인다. 안티몬 광물로는 자연 안티몬(Sb)으로 산출되기도 하지만 원료 광물은 휘안석이며, 다른 황화 광물을 처리할 때에 부산물로 생산되기도 한다.",antimony : Sb
634,알루미늄,"알루미늄은 산소, 규소 다음으로 지각 속에 많이 들어 있는 원소이다. 그러나, 화합물로 부존되는 알루미늄의 제련에 많은 비용이 소요되기 때문에 대량으로 생산되지 못하다가 최근에 수요가 늘어난 금속이다. 알루미늄을 함유한 광석 광물은 매우 많지만 원료로 이용되는 것은 보오크사이트이다.",aluminium : Al
635,알칼리공급조 SAPS,산성광산폐수에 알칼리를 공급하여 중화시키고 산화된 철이온을 생물학적 작용에 의해서 금속성분을 제거시키는 정화조를 말한다.,Successive Alinity Producing System
636,알파(α)선,전기를 가지지 않은 입자.,
637,암권과내권,코어 1270㎞ 코어 외층부 2200㎞ 맨틀 2900㎞ 부분으로 전체 6370㎞이다.,
638,암맥,"주위의 암석 구조를 잘라 판모양으로 발달되어 있는 관입암체를 말한다. 지층면이나 암체에 연직 또는 연직에 가까운 모양으로 관입해 있는 판상(板狀)의 화성암체. 두께는 수 cm에서 수십 m, 길이는 수백 m에서 수십 km에 이르기까지 그 크기가 다양하다. 맥암(dike rock)으로 구성되어 있는데, 침식저항상태에 따라 기존암석보다 두드러지고, 골을 형성하기도 한다. 또한 기존암석과 색 ·풍화점도 ·구조가 달라 구별이 쉽다.","巖脈. Dike, Dyke"
639,암모나이트,"연체 동물문, 두족강, 암모나이트목에 속하는 두족류 화석에 대한 일반 명칭. 모두 해서동물로서 5개의 아목과 1,700여개의 속이 알려졌으며, 데본기에서 백악기까지 서식하였고, 중생대 특히 쥐라기, 백악기에 크게 번성하여 중요한 표준화석이 많다. 연체부는 불분명하지만 석회질은 각은 현생 앵무조개와 비슷하다. 각의 기본 구조는 태각에서 출발한 원추형 각이 대체로 평면 나선형으로 말린 형태이며 내부는 격벽에 의해 여러 기방으로 나누어져 있고, 각구 가까이에 최종적으로 주방이 있다. 주방에서 태각까지는 격벽을 관통하는 연실세관이 있는 점은 앵무조개와 같으나 그 위치가 일반적으로 권각 외측에 접해 있다. 격벽과 각의 내면이 접하는 교선의 봉합선이라고 하는데, 초기의 것은 간단하고 부드러운 곡선을 이루지만 후기로 갈수록 점차 복잡한 형태로 변한다.",ammonite
640,암모니아다이너마이트,"질산나트륨 대신 질산암모늄을 흡수시킨 것으로, 스트레이트 다이너마이트보다 폭발력이 약하다.",
641,암상,"층리면에 평행 또는 거의 평행으로 발달되어 있는 판 모양의 관입암체를 말한다. 지층의 층리면(層理面)에 거의 평행으로 관입한 판상(板狀)의 화성암체. 지층면과의 관계를 고려하지 않으나 실(sill)과 같이 수평에 가깝지 않은 어느정도 기울어진 판상의 관입암체를 가리키는 경우도 있다. 즉, 판상의 관입체가 지층과 직각을 이루지 않는 것을 말한다.",巖床. Sheet
642,암석계수,"암석계수(g)는 암석의 발파에 대한 저항성을 나타내는 계수로서, 니트로글리세린 60%에 해당하는 다이너마이트(e=1)를 깊이 1m되는 곳(최소 저항선 W=1m)에 장약하여 완전히 전색한 상태(d=1)에서 표준 발파를 할 때 필요한 장약량을 L㎏이라 하면 L=g가 된다. 따라서, 장약량 L로 암석의 발파에 대한 저항성의 계수 g의 값을 구할 수 있다. 이와 같이, g는 암석 약 1㎥를 발파할 때 필요로 하는 폭약량이라는 뜻을 가진다.",
643,암석의비산,"발파시 암석이 불규칙하게 튀어 나가는 것을 비산이라 하며, 작은 돌의 비산은 분산(scattering)이라 한다. 작은 돌의 분산은, 몇 개의 큰 덩어리로 된 암석에 균열이 생길 때 발파공과 균열 부위를 통하여 빠른 속도로 유출되는 가스에 의해 주로 파쇄되는 국부적 현상으로 발생한다. 주변 구조물에 영향을 주거나 위험을 초래할 수 있는 비산은 화약량의 증가에 따라 많아진다.",
644,암석의순환,"암석이 형성되고 변질되고 파괴되고 재형성되는 사건의 순서. 이는 마그마작용, 침식, 운반, 퇴적, 고화 및 변성작용의 과정을 포함한다. 마그마가 정출작용으로 화성암이 되고 이는 풍화작용을 받아 퇴적물이 되어 퇴적 고화되면 퇴적암을 형성하며, 지하 심부로 이동하여 고온 고압상태에 존재하게 되면 화성암이 되고 변성작용을 받으면 변성암이 된다.","巖石의 循環, cycle of rocks"
645,암석의윤회,암석의 순환 참조.,"巖石의輪回, rock cycle"
646,암석학,"색, 광물조성, 입도와 같은 특성에 근거하여 노두나 표본에서 암석을 기술하는 것. 원래는 암석학(petrology)과 동의어로도 사용되었다.","巖石學, lithology"
647,암주,"화성관입암체(火成貫入岩體) 형태의 하나. 지구상의 암석은 크게 화성암과 변성암(變成岩), 퇴적암(堆積岩)으로 나누는데, 화성암은 다시 화산암(火山岩)과 심성암(深成岩)으로 나눌 수 있다. 심성암이란 마그마가 지하에서 오랜 세월에 걸쳐 굳은 것으로 구성광물의 조직이 조립질(粗粒質)인 것을 말한다. 한편 화성암을 관입암(貫入岩)과 분출암(噴出岩)으로 나누기도 하는데 이때 관입은 마그마가 지하에서 이동하다가 어느 부분에 이르러 냉각·고결하는 것으로 대체로 심성암이 여기에 해당되며, 분출암은 즉 화산암이다. 암주란 화성암 가운데서 바로 이 관입암의 형태와 규모, 주위 암석과의 상호관계 등에 따라 구분할 때의 한 형태이다. 관입암은 기존의 암층과 조화를 이루어 나란히 접촉하면서 암상(岩床)이나 병반(餠盤), 분상암체(盆狀岩體) 등의 형태를 이루기도 하지만, 암주나 저반(底盤)처럼 규모가 큰 형태일 경우에는 그와 같이 기존의 암층과 조화를 이루기가 어렵다. 흔히 R.A.데일리가 1914년 평면상의 노출면적이 100km² 이상 되는 거대한 심성암체를 저반, 그보다 작은 것을 암주라고 하여 구분한 것에 따르지만, 암주는 지하로 갈수록 표면적이 넓어져 저반으로 연결되기 때문에 따로 구분하지 않기도 한다. 암주나 저반의 아랫부분은 지하 깊숙이 자리잡고 있으므로 아직 제대로 규명되지 않고 있다. 저반이란 용어는 1888년 조산대(造山帶)의 중핵부에 형성된 화강암질의 관입암체를 설명하면서 E.쥐스가 처음 사용한 것이다. 우리나라의 경우 청주-원주-강릉에 걸쳐 넓게 분포하는 쥐라기의 화강암체가 대보조산운동(大寶造山運動)과 관련된 대규모의 저반인 것으로 알려져 있다. 지표에 노출된 면적이 200㎢ 이하인 화성 암체를 말한다. boss라고도 한다.","岩株, stock/boss"
648,압력도움설,"지하에 갱도가 개설되면 갱도를 향하여 억압되어 있던 지압이 개방되면서 밀고 들어오려는 반압이 생기게 되며, 갱도 상부 쪽 암반은 이 현상으로 인하여 파괴 되면서 모암에서 분리되는 면압권이 생긴다. 이와 같은 면압권은 상부로 갈수록 면적이 작아져서 일종의 도움 현상을 이루게 된다는 학설을 압력 도움설이라 한다.",pressure dome
649,압력여과기,광액에 압력을 가하여 여액을 분리시키는 여과기.,filter press
650,압축공기기관차,"폭발성 가스에 대해서는 가장 안전한 기관차이나, 운반 효율이 낮아 거의 사용하지는 않고 있다.",壓縮空氣機關車
651,압축기,압축 공기를 인공적으로 만드는 기계.,壓縮機
652,액체폭약,"액체 폭약에는 슬러리 폭약과 에멀션 폭약이 있다. 1) 슬러리(slurry) 폭약 산소 공급제인 질산암모늄에 물을 혼합하여 만든 폭약으로서, ANFO 폭약의 단점인 흡습성을 보완하기 위하여 개발된 함수 폭약이다. 슬러리 폭약은 폭약 안에 물이 포함되어 있기 때문에 다른 폭약에 비하여 충격, 마찰과 화염 등에 안전할 뿐만 아니라, 폭발 후 유독 가스의 발생이 적어 갱내 발파 작업에 많이 사용되고 있다. 2) 에멀션(emulsion) 폭약 혼합된 두 액체가 완전히 혼합되지 않고, 한 액체의 입자가 다른 액체 내에 분산되어 있는 콜로이드 상태의 액체이다. 에멀션 폭약의 성능은 폭약 내에 분산되어 있는 유리 기포(glass bubble)의 크기와 두께에 영향을 받으며, 유리 기포의 크기가 작을수록 폭발 속도는 증가한다.",함수폭약
653,약면화약,"강면 화약의 반대로서 N=12%이하를 말함. ""강면화약"" 조 참조.",
654,양도체광물,"자연 금속들이나 또는 금속 함유 광물들, 이를 테면 황철석, 자황철석, 황동석, 방연석, 휘은석, 각섬석, 대부분의 황화물, 대부분의 구리, 철, 은, 망간 광물이며, 불량 도체 광물로서는 석영, 규암, 방해석, 석회석, 점판암, 사암, 석류석, 섬아연석, 중정석, 석고, 화강암, 형석, 모나자이트, 대부분의 규산염 광물들이다.",
655,어룡탄광,"강원 태백시 화전동(禾田洞)에 있는 탄광. 연간 약 12만 t의 석탄을 생산한다. 국내에서는 처음으로 수력채탄(水力採炭)을 시도, 수력채굴 ·수력수송 및 탈수장치의 실험을 실시하고 있으나 모니터(monitor)의 수압부족과 탈수시 분탄(粉炭) 유실량이 많은 점 등 아직 해결해야 할 문제가 많다. 광구 일대의 지질은 광구의 북쪽으로부터 평안계(平安系)의 홍점통(紅店統) ·사동통(寺洞統)과 고방산통(高坊山統)에 대비되는 함백산층(咸白山層) 및 녹암통(綠岩統)에 해당되는 동고층의 순으로 구성되어 있다. 중앙부에 있는 본갱(本坑)과 용갱 등에서 채탄이 시작되었고, 상부는 거의 채진(採盡)되었으며 주로 용운갱에서 개발이 진행되고 있다. 이 용운갱 부근의 탄폭은 동부가 평균 6 m 정도이고 서부는 2∼4 m 정도인 부광층(富鑛層)이며 부광대에는 너비 약 30 m, 길이 200 m나 되는 좋은 층을 가지고 있다. 매장량은 약 1,000만 t이고 이 중 가채광량(可採鑛量)은 약 713만 t이다.",魚龍炭鑛
656,억제제,부유성 광물의 부유성을 제거하는 능력을 가지고 있다. 실제 부유 선광에서 어떤 특징의 광물만을 부유 시키고 그 밖의 광물은 뜨지 못하게 할 때 없어서는 안될 시약이다.,dipressor
657,언로우더,압축되는 공기 압력이 일정량 이상 높아지지 않도록 하기 위하여 압축 작용을 일시 중지시키는 장치이다.,unloader
658,에너지이용합리화사업,에너지 절약형 경제로의 전환을 위한 총체적 절약기반 구축과 에너지 소비증가율을 경제 성장률 보다 낮은 수준으로 유지 및 환경규제에 대비한 CO2감소 역량 배양 등으로 에너지 절약을 통해 경제 위기 극복을 위하여 국가절약 과제로 추진하고자 하는 것을 말한다.,에너지利用合理化事業
659,에너지자원,"석탄, 석유, 가스, 핵연료, 대체 에너지. 대체에너지로 활용할 수 있는 자연의 힘으로서는 태양열, 풍력, 조력, 지열 등이 있는데, 이의 대부분은 이미 실용화 되고 있다. 일본, 이탈리아, 뉴질랜드, 미국 등은 현재 지열을 이용해서 수십만 킬로와트의 발전을 하고 있으며, 이용 지역은 대부분 화산지대 또는 온천 지대로서, 지구의 평균 온도 상승률에 비해 훨씬 높은 지역이다.",energy 資源
660,에멀션(emulsion)폭약,액체폭약(함수폭약) 조 참조.,
661,엠파이어시추,"원동기나 기계 공업이 발달되기 전까지 많이 이용되었던 방법으로서 사금이나 중사 광산에서 많이 사용되어 엠파이어 시추라고 불렸다. 소나 말의 힘으로 발판을 돌려 케이싱 파이프를 회전시킴으로써 파이프가 흙 속에 파고 들어가게 한 방법으로서 이 시추에서는 파고 들어가는 속도를 빠르게 하기 위하여 파이프 속으로 일종의 정과 같은 로드(rod)를 발판 위의 사람들이 물을 넣어 주면서 아래위로 움직여 구멍을 뚫고, 로드 끝의 샌드 펌프(sand pump)로 암석가루를 퍼내며 분석 시료로 한다.",
662,여과,"묽은 광액으로부터 수분을 제거하여 50-65% 정도의 고체를 포함하는 광액을 만드는 작업을 농축이라 하며, 이 농축 작업으로부터 더 한층 탈수하여 90%전후의 고체를 포함하는 케이크를 만드는 작업을 말함.","濾過, filtration"
663,여과기,"여과는 여과재(filtation medium)라고 하는 미세한 다수의 모세관으로 구성된 칸막이를 통하여 광액을 통과시킴으로써 고체 입자들을 여과재 위에 분리, 축적시키는 작업이며, 여과재 위에 축적된 고체를 케이크라 하고, 여과를 할 수 있도록 제작된 기계를 여과기라 한다.",濾過器
664,여재,여과에 필요한 다공질의 격벽. 여과는 여재를 통과할 때 작용하는 힘을 주는 방법에 따라 여러 가지로 분리된다.,
665,역기폭,전폭약의 장전 위치에 따라 발파공에서 가장 바깥쪽에 두는 방법인 정기폭과 안쪽 끝에 두는 방법인 역기폭으로 나뉜다. 도화선의 길이가 길어지며 폭약을 다져 넣는 데 주의해야 하지만 기폭점이 안쪽에 있으므로 발파 위력이 내부에 더욱 크게 작용하여 잔류공을 남기는 일이 없다.,
666,역단층,"단층의 일종으로 일반적으로는 연직단면성에 경사진 단층면의 상측에 있는 지층(상반)이 하측에 있는 지층(하반)보다 위로 올라간 것을 말하며, 압축성의 힘에 의하여 양측의 지층이 서로 접근 중복하는 모양같이 생긴 단층을 말할 경우도 있다. 경사진 단층면의 상반(上盤)이 하반(下盤)에 비해서 밀려 올라간 단층. 압축단층이라고도 한다. 암체가 좌우로부터 강한 압축 변형력을 받고, 상하로는 전장(展張) 변형력이 작용하여 파단(破斷)하고 변위(變位)하여 생긴다. 일반적으로 역단층의 단층면의 경사는 작으며, 특히 단층면의 경사가 수평에 가까운 것을 오버스러스트단층이라고 한다. 이와 같은 역단층은 지층의 습곡구조에 수반되는 경우가 많으며, 대규모의 지각운동에 의해서 생긴다.","逆斷層, reverse fault"
667,역산실수율,정광과 광미의 무게와 품위에서 원광의 무게와 품위를 산출하여 계산한 것을 말함.,
668,역청사,"모래, 물과 함께 유기물 기원의 역청질 물질이 섞여 있는 것으로서, 일반적으로 역청질 물질이 약11% 함유되었으며, 이 중에 원유는 50-60% 들어 있다. 역청사는 배네수엘라, 캐나다, 소련 등에 많은 매장량이 알려져 있다.","tar sand, oil sand"
669,역청탄,"아역청탄(subbituminous coal)과 무연탄의 중간에 해당하는 석탄. 14%이상의 휘발성 물질을 포함하여 11,500BTU/1b이상의 열량을 가진 석탄. 암갈색 내지 흑색을 띠며 연기를 내면서 연소된다. 특히 순탄칼로리 8,100이상의 석탄으로서 점결성을 가져야 한다.","瀝靑炭, bituminous coal"
670,연,"연은 사용 비철금속 중에서 가장 비중이 무거운 금속이나 쉽게 가공할 수 있으며, 묽은 산에는 잘 용해되나 진한 염산과 황산 등에는 잘 용해되지 않는 특성이 있다. 연은 축전지, 화학 공업용관, 연피복 케이블, 감모합금, 땝납, 활자용 합금, 무기, 약품 제조를 비롯하여 방사능 차단제 등 주요 광물로서 다양한 분야에 이용되고 있으며, 주요 용도는 축전지용으로 자유세계 총소비량의 60%이상, 국내 소비량의 70%이상을 점유하고 있다.","鉛, Lead"
671,연소속도,화약류 연소시의 화염 전파 속도를 말함.,
672,연소열,가연성 물질 1㎏ 또는 1몰(mol)이 표준 상태에서 완전히 산화할 때 발생하는 열량.,
673,연소한계농도,가연성 가스와 공기의 혼합 기체가 점화에 의하여 연소되는 가연성 가스의 농도이다.,
674,연속운반기,"광산에서 사용되는 연속 운반기는 컨베이어(conveyor)가 있으며, 이것은 갱 안에서 광석이나 석탄 운반에 많이 쓰이는 운반기계이다.",
675,연속천공절단법,압축 강도가 800㎏/㎠이상인 견고한 암석 절단법.,
676,연수정,연한 흑색 내지 흑색의 석영. 진한 색의 것은 흑수정이라고도 한다. 방사선의 영향으로 착색된 것이다. 페그마타이트에서 자주 볼 수 있다. 특히 방사성 광물에 접한 부분은 진한 색을 띤다.,"煙水晶, smoky quartz"
677,연층갱도,"굴진갱도. 대체로 갱도는 광상 속 또는 암반 속에 만들어 주는 두 경우가 있는데, 탄층에서는 연층 갱도로",
678,연탄가격안정지원금,"정부가 서민연료의 안정적 공급을 위하여 연탄의 최고 판매가격을 동결하고, 연탄제조업자와 연탄수송업자에게 생산원가와 판매가격의 차액을 보전해주기 위하여 연탄제조비, 연탄수송비, 해상조작비 및 해상수송비 등 연탄생산원가의 일부를 지원하는 금액을 말한다.",煉炭價格安定支援金
679,열극충전광상,모암 중열극(갈라진 틈)을 채워 생긴 광상을 말한다.,"裂隙充塡鑛床, Fissure vein, Fissure filing deposit"
680,열상건조,"열상을 이용하는 간단한 가열 건조로서, 불이나 뜨거운 가스 위에 철판이나 시멘트 온돌을 놓고 그 위에서 광석을 말린다. 다른 작업에서 남은 폐열을 이용할 수 있으면 경제적이다.",
681,열쇄선별법,"여러 가지 광물의 결정들이 복잡하고 치밀하게 들어 있는 광석덩이를 급열한 다음 급랭시키면 각 광물은 열전도도와 팽창 계수가 서로 다르므로 결정들의 경계면에 무리가 생긴다. 또, 그 사이에 수분이 들어 있는 경우 매우 팽창되어 파괴력을 나타낼 수도 있으므로, 이와 같이 결정체들이 그 경계면에서 부스러지기 쉽게 된다.",
682,열수광상,400℃ 가까운 수용액이 지각의 틈을 따라 들어오면서 기존 암석과 반응하여 여러 가지 광석 광물을 침전시킨 것.,"熱水鑛床, hydrothemal deposit"
683,열수시대,마그마 고결의 4단계중 마지막 단계.,
684,염기성암,"산화규소의 함량이 약 50 % 전후인 화성암. SiO2 양이 45∼52%이며 색은 암색이다. 화성암의 화학조성을 그것에 함유된 금속원소 산화물의 무게백분율로 나타내면, 일반적으로 산화규소의 백분율이 가장 높아 40∼70 %에 이른다. 산화규소의 함량이 높은 것부터 차례로 산성암 ·중성암 ·염기성암 ·초염기성암으로 구분된다. 화산암으로서는 현무암, 심성암으로서는 반려암이 염기성암이다. 산화규소의 백분율에 의해서 염기성암을 정의하면, 그 조성은 어느 정도 한정된다. 염기성암에서는 일반적으로 산화알루미늄 Al2O3이나 알칼리(Na2O와 K2O)가 적고, 철(FeO와 Fe2O3)이나 산화마그네슘 MgO가 많다. 여기서 염기성이라고 하는 것은 화학에서 산이나 염기라고 하는 경우의 염기성과는 전혀 관계가 없다.","鹽基性岩,Basic rock"
685,염소산염,"일반식 MIClO3(MI는 1가의 금속)이다. 나트륨염 ·칼륨염 ·리튬염 ·바륨염 등이 알려져 있다. 염소산염의 특색은 강한 산화력인데, 이 점을 이용하는 용도가 있다. 염소산염 중 가장 중요한 것으로 칼륨 및 나트륨이 있다. 나트륨염 NaClO3은 흡습성이 있어 용액 형태로 이용되는 경우가 많은데, 과염소산염의 제조, 염료의 제조, 제초제 등에 사용된다. 제초제로는 수용액을 살포함으로써 삼림지나 원야(原野)의 조릿대의 구제와 과수원 ·뽕나무밭 등의 제초에 사용된다. 칼륨염 ·칼슘염도 같은 용도에 쓰인다. 염소산칼륨 KClO3 및 염소산나트륨 NaClO3는 염화칼륨 KCl 또는 염화나트륨 NaCl의 수용액을 전기분해하여 제조한다.","鹽素酸鹽, chlorate"
686,염소산염폭약,"염소산염을 주성분으로 하고, 가연성 물질로 인(P), 황(S) 등의 황화물을 배합한 폭약이다. 염소산칼륨(KClO3)은 염소산염의 대표적인 것으로, 산소 원자 3개를 가지고 있으며 폭발 감도가 대단히 높기 때문에 취급과 사용에 주의해야 한다. 폭발 반응시의 산소 방출량은 질산염보다 작으나 반응 속도가 빨라 산소의 방출이 쉽다.",
687,염소산칼륨,"광택이 있는 무색의 단사정계결정. 화학식 KClO3. 녹는점 368℃, 비중 2.326(39℃)이다. 가열하면 400℃에서 분해하여 과염소산칼륨과 염화칼륨이 된다. 4KClO3 → 3KClO4＋KCl 더 가열하면 산소를 방출하고 전부 염화칼륨이 된다. 이 반응은 산화망간 MnO2와 같은 금속산화물을 가하면 촉진되어 70℃에서 산소를 발생하기 시작하므로, 실험실 등에서 산소를 얻기 위해 이용된다. 단, 유기물 ·황 ·탄소 등이 혼입되면 폭발하므로 주의해야 한다. 흡습성은 없다. 물에 녹고, 알코올에도 소량 녹는다. 중성 및 알칼리성용액에서는 산화작용이 없으나, 산성용액에서는 강한 산화제가 된다. 염화칼륨수용액을 뜨거울 때 전기분해하여 만든다. 산화제로서 성냥 ·연화 ·폭약 등의 원료가 되고, 표백제 ·염료 ·의약품 등의 제조에도 사용된다. 장기간 보존한 것은 아염소산칼륨을 함유하여, 건조 상태에서는 유기물 ·인 ·황 등 가연성 물질과 접촉하기만 해도 폭발한다. 마찰 ·충격 등에 예민하여, 폭발사고를 잘 일으키며, 진한 황산 ·진한 질산과 접촉해도 잘 폭발한다. 혼합폭약으로 쓰이기도 하며, 극약이다. 빛이 차단되는 밀폐된 용기에 보관한다.","鹽素酸, potassium chlorate"
688,염화배소,광석을 염소가스 또는 염화물과 같이 가열해서 광석 중의 목적 금속을 수용성 또는 휘발성의 염화물로 바꾸는 조작을 말한다. 대표적인 예로서는 황산 제조시 배소한 황철석의 잔재에 소금을 가해서 배소하면 동분이 염화제2동(수용성)으로 침출되어 구리를 회수하는 방법이다.,
