연번,용어명,용어설명,유사용어
918,질산암모늄,"흰색 결정으로서 물에 잘 녹고 흡습성이 강하며, 수분을 흡수하면 스스로 용해하여 액체로 변화한다. 그러므로 질산암모늄이 배합된 폭약은 수분이 흡수되지 않도록 포장을 철저히 해야 한다. 질산암모늄은 반응 온도에 따라 결정의 모양이 달라지고, 비중도 변화한다. 그리고 녹는 점은 169℃ 이지만, 100℃ 부근에서 반응하기 시작한다.",NH4NO3
919,질산암모늄폭약,"질산암모늄을 주성분으로 한 것으로서, 폭발 감도와 위력을 강화시키기 위하여 NG등의 폭발 예감제를 배합하여 만든 폭약으로서 흡습성이 크다. 따라서, 폭약에 수분이 흡수되면 굳어져서, 폭발 감도와 위력을 떨어지게 하는 단점이 있다.",
920,질산에스테르,"알코올기를 가진 화합물을 질산과 반응시켜, 알코올기가 질산기로 치환된 에스테르를 질산에스테르라 한다. 즉, 알코올과 산이 반응하여 물이 분리된 화합물을 에스테르라 하며, 질산을 반응시킨 것이 질산에스테르이다. 폭약으로 사용되는 질산에스테르에는 니트로글리세린, 니트로셀룰로오스, 펜트리트 등이 있다.",
921,질산칼륨,"오래전부터 흑색 화약의 산소 공급제로 사용되었으며, 질산나트륨과 염화칼륨 용액을 반응시켜 만든다. 화학식 KNO3. 천연으로는 초석(硝石)으로서 칠레의 사막지대, 미국 서부의 건조지역등에서 산출된다. 무색의 사방정계(斜方晶系) 결정으로서 녹는점 333 ℃, 비중 2.11, 굴절률 1.5038이다. 녹는점 이상으로 가열하면 분해하여 산소를 방출한다. 2KNO3 → 2KNO2＋O2 물 10 g에 대하여 0 ℃에서 13.3 g, 100 ℃에서 246 g 녹는다. 에탄올에는 약간 녹지만 물에는 쉽게 녹는다. 질산나트륨과는 달리 흡습성이 없으며, 짠맛과 청량미(淸凉味)가 있다. 가연성(可燃性) 물질과 공존하면 폭발한다. 염화칼륨의 뜨거운 수용액에 칠레초석(질산나트륨)을 가하여 복분해에 의해서 만들거나, 탄산칼륨 또는 수산화칼륨을 질산에 녹여서 만든다. 흑색화약 ·성냥 ·불꽃놀이용 폭죽 등의 제조원료로 사용되며, 비료 ·유리 ·유약(釉藥) 등의 원료 및 산화제 ·의약품, 또 육류의 살색고정제 등으로도 사용된다.","窒酸- , potassium nitrate"
922,질석,"단사정계(單斜晶系)에 속하는 광물로서 버미쿨라이트라고도 한다. 굳기 : 1∼2 비중 : 2.76 색깔 : 회백색 또는 갈색 화학성분은 CMg, Fe3+, Al3(Al,Si)4O10(OH)2·4H2O로 알루미늄 ·마그네슘 ·철의 수산화규산염으로 된 점토광물이다. 굳기 1∼2, 비중 2.76이다. 쪼개짐은 ［001］ 면에 완전하다. 회백색 또는 갈색이며, 진주광택이 난다. 산(酸)에 쉽게 분해되고, 양이온 교환능력이 크다. 가열하면 팽창한다. 사문암 지대에서 산출된다. 다공질(多孔質)이며, 흡수능력이 좋아서 내열재료 및 방음재(防音材)로서 널리 이용되고 있다. 명칭은 가열했을 때 지렁이와 비슷하여 지렁이를 뜻하는 라틴어 ‘vermiculare’에서 유래하였다. 쉽게 설명한다면 운모와 비슷한 모양으로 연한 갈색을 띠는 광물로서, 가열하면 부피가 팽창하는 특이한 성질이 있으며, 이 성질을 이용하여 건물의 내장재로 이용된다. 이는 열손실을 방지하고 잡음을 흡수하는 효과가 있다. 경기도의 변성암 지대에서 많이 산출된다.","蛭石,Vermiculite"
923,질소산화물,산소 함유량이 가연성 물질의 함유량보다 많으면 폭발할 때 유독한 질소 산화물이 생성된다.,NOx
924,질화납,"물속에서도 폭발하며, 낮은 온도로 가열해도 분해되는 일이 없으므로 물 속에 저장하면 안전하다. 그러므로 질화납은 뇌홍에 비하여 원료의 가격도 싸며 보존성도 우수하다. 그러나, 결점으로는 발화점이 높고, 결정 입자에 따라 예민한 것과 둔한 것이 있으므로 폭발의 확실성이 적다. 기폭력은 뇌홍보다도 우수하며, 뇌관의 관체로는 알루미늄을 사용한다.",Pb(N3)2
925,집진기,기체 중에 부유(浮遊)분진을 포집한 장치를 말한다.,"集塵機, Dust collector"
926,쪼개짐,"광물이 결정면에 따라 쪼개지는 성질. 결정구조를 반영한다. 벽개라고도 한다. 암석이 밀접한 간격의 면상구조를 따라 쪼개지는 성질. 광물의 벽개와 구별하기 위해 ""암석벽개""라고도 한다.","劈開, Cleavage"
927,착색제,"불꽃이 색깔을 띠게 하기 위하여 불꽃 속에 색을 내는 물질을 첨가하는데, 스트론튬 화합물은 빨간색, 나트륨염은 노란색, 바륨염은 녹색, 구리 화합물은 파란색을 각각 띠게 한다.",
928,착암기,"1) 굴진갱도내에 굴진시 사용하는 기계로서 압축공기로 타격력을 주어 움직이는 기계. 2) 압축 공기나 전기 모터의 동력을 이용하여 해머를 전·후진시키면서 삽입된 로드의 선단부인 샹크(shank)에 타격력을 가하고, 이 타격력이 암반에 전달되어 파쇄 천공하거나 또는 로드를 회전시켜 로드 끝 부분의 비트가 암반에 회전 삭마작용을 주어 천공하는 기구를 말한다.","鑿巖機, Rock drill"
929,찰렌해연,"세계에서 가장 깊은 해구 중의 하나로서 그 깊이가 10,863m에 달한다.",
930,채광법,"1. 채광법의 분류 채굴하고자 하는 목적 광물의 위치, 즉 지하에 위치하는지 지상에 위치하는지, 또는 해저에 위치하는지에 따라 채굴 방법은 갱내 채굴, 노천 채굴 및 해저 채굴 등으로 그 채굴 방법이 구분되며, 일반 광석과 석탄을 채굴하는 데에도 채광법과 채탄법으로 구분하여 불리게 된다. 광석을 채굴하는 장소의 암반의 강도에 따라 무지지 채굴법,지지 채굴법 및 붕락법으로 분류되며, 채굴한 공동을 그대로 방치해 두어도 충분히 견딜 수가 있어 아무런 지지를 하지 않아도 될 경우 무지지 채굴법이라 하고, 채굴에 의하여 만들어진 공동을 자연적으로나 인위적으로 붕락되지 않도록 지지해 주는 채광법을 지지 채굴법이라 한다. 그리고, 채굴 후의 공동을 강제적으로 붕락시키는 채굴법을 붕락법이라 한다. 2.채광법의 선택 여러 가지 채광법이 있으나, 채광법을 선택할 때에는 안전, 능률, 경제의 세 가지 요건을 구비할 수 있는 방법을 선택해야 한다. 아무리 능률이 좋고 비용이 적게 드는 경제적인 채광법이라도 보안상 위험이 따르면 채택할 수가 없으며, 안전하게 작업을 할 수 있는 채광법이라도 경제성이 없으면 채택될 수가 없기 때문이다. 이와 같은 채광법 선택의 3대 요소를 구비한 채광법을 결정하기 위해서는 다음과 같은 조건이 고려되어야 한다. 즉, 광상의 형태와 규모 및 경사, 광석의 물리적 성질, 품위, 분포 상태, 상하반의 강도 등에 대하여 면밀히 검토한 다음 결정해야 한다. 3.채광법의 선택과 광산 경영 채광법이 결정되면 채광에 들어가기 전에 광산 전반에 걸쳐 운영 계획을 수립해야 하며, 이를 위해서는 생산량과 능률, 인원 계획 및 투자 규모, 생산 원가 계획과 판매 계획 등을 사전에 면밀히 검토하여 세우게 된다. 이와 같은 과정이 끝나면 본격적인 채광에 들어가는데, 광산 경영에서 이익을 올릴 수 있는 방법은, 생산을 위하여 투입되는 전체 금액인 생산 원가 보다 생산된 광석을 매광한 판매 수익이 많을 때 이익이 남게 되고, 반대로 판매 수익이 생산 원가보다 적으면 적자가 나게 된다. 따라서, 광산의 경영에서 이익을 남기려면 판매 가격은 임의로 조정할 수 없으므로 생산 원가를 적게 들도록 노력하여 비용을 절감하거나, 톤당 이익은 작더라도 많은 양을 생산함으로써 이익을 올릴 수 있도록 해야 한다. 이와 같이, 생산 원가를 낮추는 데에는 무엇보다 채광법 선택의 비중이 크다는 것을 알아야 한다.",採鑛法
931,채광사업,"탐광 실적이 인정되거나 탐광의 필요 없이 채광 사업을 개시하려고 할 때에는 채광 사업을 개시하기 전에 채광 계획서를 작성하여 산업 자원부 장관(도지사)의 인가를 받아야 한다. 채광 계획서에는 광산의 연혁, 지질 및 광상, 채광 방법, 선광 방법 및 제련 방법, 주요시설 계획, 판매 계획 및 수지 예산, 광산 보안 시설 계획 등을 상세히 기록하여 제출해야 한다. 만일, 광업권자가 채광 계획서의 인가를 받지 않고 광물을 채굴할 경우, 벌칙의 적용을 받게 될 뿐만 아니라 광업권의 취소 처분을 받을 수도 있다. 이와 같은 채광 계획이 자원의 합리적인 개발이나 광해 및 광산 보안상 불합리하다고 인정될 때, 산업 자원부 장관(도지사)은 채광 계획의 변경을 명령할 수 있으며, 이에 위반하면 역시 광업권을 취소 할 수 있다.",採鑛事業
932,채광용전기뇌관,"지하자원 개발 또는 물리 탐사에 사용되는 뇌관으로, 점화에서 폭발까지의 시간이 짧아야 하며, 폭굉 시간도 짧아야 한다. 일반적으로, 채광용 전기 뇌관의 폭발 간격은 0.1밀리세컨드 이하이다.",
933,채굴적,산림법 등 관계법률에 의한 채석허가 또는 토석 채취허가를 받아 석재로 사용하기 위하여 암석채취를 업으로 하는 자를 말한다.,採掘跡
934,채석발파,"채석발파는 크게 2종으로 나뉜다. 첫째는 암체에서 상당한 크기의 석재를 절단해 내는 것이고, 둘째는 시멘트 원료용 석회석, 제련용 규석, 축조용 석재 등과 같이 크기가 문제되지 않는 경우의 발파이다. 전자는 암체에 진동 작용을 주어 절단하는 것으로 주로 흑색 화약을 사용하는 경우가 많으며, 후자의 경우는 암체를 잘게 분쇄하여야 되기 때문에 맹성 폭약을 사용하며 계단식 노천굴 발파 방법과 동일하기 때문에, 여기에서는 주로 석재를 절단하는 발파 방법만 취급하기로 한다.",quarry blasting
935,채석업자,산림법 등 관계법률에 의한 채석허가 또는 토석 채취허가를 받아 석재로 사용하기 위하여 암석채취를 업으로 하는 자를 말한다.,採石業者
936,채석장,"석재, 채석 혹은 모래, 점토, 석회석 등의 채굴장을 말한다. 일반적으로 석재류를 채굴하는 장소를 말하며, 대부분이 노천채굴(露天採掘)이기 때문에 때로는 수직으로 우뚝 솟은 거대한 암벽이 만들어진다. 토목 ·건축용 석재의 채석장에서는 대형의 석재를 규칙적으로 깎아내지 않으면 안 되므로 수직의 평면벽으로 둘러싸인 대건축물의 모습을 드러내는 경우도 있다. 한편, 콘크리트 골재로 쓰는 쇄석 등의 채석장에는 크러셔(crusher)나 선별기(選別機)를 설치해 놓고 분쇄된 크고 작은 암석들을 골라서 반출한다. 대규모의 채석장에는 전용궤도를 갖춘 곳도 있으며, 설비가 빈약한 소규모에 이르기까지 매우 다양하다.","採石場, Quarry"
937,채수율,"매장되어 있는 석탄의 총광량 중에서 얼마나 채굴되어 회수되었는가를 중량 백분율로 나타내는 것으로, 매장된 탄의 형태, 규모, 경사, 상하반의 상태, 채굴방법등에 따라 채수율은 달라진다.",採收率
938,채준,석탄을 생산하기 위해 탄중으로 지보를 설치하여 생산을 준비하는 과정을 말한다.,採準
939,채탄능율,채탄기능원 1인이 1교대(8시간)작업중 생산한 석탄의 양을 말한다.,採炭能率
940,채탄법,"석탄을 채굴하는 것은 일반 광석에 비하여 지압이 크게 작용하고, 석탄의 산화열이나 폭발성 가스를 제거하기 위하여 많은 통기 장치가 요구될 뿐만 아니라, 출수나 화재 등의 재해 위험률이 높으므로, 금속 광산의 채광법과는 구분하여 석탄을 채굴하는 방법을 채탄법이라 한다.",採炭法
941,채탄부,직접부중 직접 탄을 생산하는 작업원을 말한다.,採炭夫
942,챌린지급광기,"약간의 경사를 가지고 설치되어, 천천히 회전하고 있는 원형의 판자 경사면 위에 호퍼(hopper) V로부터 내려오는 광석이 떨어지도록 되어 있다. 이 광석은 원판의 표면을 따라서 돌다가 주걱(scraper)에 걸려 아래로 굴러 떨어진다. 그러나 실제 괴상에 주로 쓰이며, 속도도 조절할 수 있다.",challenge feeder
943,천공간격,"발파에 따른 천공간격이 조절 되어야만 폭약의 불발 사고를 줄일 수가 있으며, 될 수 있는 천공간격을 넓게 하여야 한다.",
944,천공법,"천공법은 1차 발파시의 천공 발파 방식에 준하나, 장약량은 다음 계산식에 의한다. L=CD2 여기서, L:장약량(g) , D:암괴의 최소 지름(cm) , C:발파계수(0.07-0.01) 이 방법은 파쇄된 암석의 적절한 위치에 천공하고 장약해서 발파하는 방법이다. 따라서 파쇄된 암석의 가장 짧은 지름과 가장 긴 지름을 정확히 측정하여 소요 폭약량을 산출하고, 천공의 위치, 천공의 길이 등을 결정 해서 작업해야 한다. 이 방법은 외부 장약법이나 사혈법보다 적은 화약량으로 발파가 가능하며, 공해 대책으로서도 적절한 방법이다. 천공장은 일반적으로 가장 짧은 지름의 60-65%이다.",
945,천공작업,"발파공을 천공하는 작업이며, 발파공의 위치, 깊이, 크기 등은 발파의 목적, 사용하는 폭약, 암반의 성질, 자유면의 상태 등에 의해서 결정된다. 더욱이 갱도 굴진에 있어서는 갱도의 단면 모양, 갱도의 방향 및 기울기를 확실히 유지하면서 굴착을 진행해야 하기 때문에, 발파공의 배열과 방향에 대해서 신중히 고려해야 한다. 발파공의 방향과 발파공의 효과는 밀접한 관계가 있다. 즉, 발파공이 단일 자유면에 직각일 경우에는 발파 효과가 최소로 되고, 자유면과의 각도가 작아짐에 따라 일정한 정도까지 그 효과가 커진다. 갱도 굴진에서의 발파공은 심빼기와 주위 확대의 목적에 따라, 그 배열과 방향이 달라진다. 심빼기를 위한 발파공은 앞에 설명한 바와 같으며, 주위 확대를 위한 발파는 심빼기 후에 잔류하는 부분의 암석을 파쇄하여 목적하는 크기의 갱도로 넓혀 주는 발파이다. 따라서 주위 확대를 위한 발파공의 배열과 방향을, 심빼기 부근에서는 심빼기에 의해서 생긴 새로운 자유면에 될 수 있는 한 평행하도록 천공하고, 갱도 벽이나 상하반 부근에서는 이들에 거의 평행하게 천공해야 한다.",
946,천매암,얇은 박편으로 쪼개지는 세립의 이질암 기원 변성암. 광물 조성이 서로 다른 얇은 층이 박편상 구조로 평행하게 발달한다. 박편상의 면에는 견사광택의 백운모가 보인다. 저온 광역 변성작용의 산물로서 점판암과 편암 사이의 중간적인 변성암이다.,"千枚岩, phyllite"
947,천반,"갱도나 동굴 천장을 이루고 있는 암석, 또는 광체 위에 있는 암석.","天磐, roof"
948,천연가스,"평상 온도와 압력 하에서는 기체나 증기로 존재하는 탄화수소. 메탄이 가장 중요하며 그 외에 에탄, 프로판도 있다. 흔히 불순물로서 질소(N2), 탄산가스(CO2), 황화수소를 포함한다.","天然-, natural gas"
949,천인율,근로자 1000명당 재해자수를 말한다. 천인율=재해자수/근로자수×103,千人率
950,철봉시험,폭약의 내화성을 시험하는 방법. 이의 방법은 시료 100g을 석면판 위에 놓고 약 900℃로 가열한 철봉을 접촉시켜 보는 것이다.,鐵棒試驗
951,철재지보,지보의 한 종류로서 외국에서는 주로 채탄 막장에서 많이 사용한다.,鐵材支保
952,첨피법,"화약 제조 방법의 하나로서 회전 드럼에 가루 화약과 지름 1mm정도의 종약(種藥)을 넣고, 드럼을 회전시키면 종약의 주위에 가루 화약이 들어 붙는 제조방법을 말한다.",chumpy
953,청식제,광립의 표면을 깨끗하게 하여 부유도를 높여주는 것.,cleasing veagent
954,체비,"크기가 서로 다른 입자들이 혼합되어 있을 때, 크기가 다른 많은 체를 사용하여 분립한다면, 더욱 미세한 입자의 무리로 분류되어 입자의 크기를 고르게 할 수 있다. 이 때, 서로 인접한 체눈의 크기의 비가 일정한 값을 가지도록 체를 배열하여 사용하는 것이 좋다. 이 인접한 체눈의 비를 체비라 하며, 인접한 두 체눈의 지름 또는 한 변의 비로써 나타낸다.",sieve ratio
955,체의공극율,"체의 총면적과 체 내의 구멍의 총 면적과의 비율을 백분율로 나타낸 것을 체의 공극율이라 한다. 여기서, ø: 공극율(%) , S : 체의 총면적(㎠) , s : 체 구멍의 총면적(㎠)",
956,체인소절단법,"채석 발파의 한 방법으로서 연속 천공 절단법, 제트 버너 절단법의 경우는 압축 강도가 200kg/cm2이하의 연약한 암석을 절단하며, 체인소(chain saw)절단법의 경우는 강도가 높은 화강암의 경우에 적용된다.",
957,체인컨베이어,"철재 트로프(trough) 속에서, 체인에 일정한 간격으로 철봉을 가로로 붙인 스크레이퍼를 이동시켜 운반물을 운반시킬 수 있도록 만들어져 있는데, 체인이 1개인 싱글 체인 컨베이어와 2개인 더불 체인 컨베이어가 있다.",
958,체질,"체질 작업은 일정한 크기와 구멍을 가진 체로 광립을 크고 작은 것으로 분리하는 것이며, 체질한 결과 체눈을 통과한 것을 망하 산물(undersize product), 체에 남은 것을 망상 산물(oversize product)이라 한다. 체는 철판에 원, 정사각형, 직사각형 및 긴 타원형 등 여러 가지 구멍을 뚫은 것도 있고, 구멍이 작을 때에는 철사로 그물을 짜서 만든 것도 있다. 이 때, 체눈의 크기는 지름 또는 짧은 변의 간격으로 나타낸다.",screening
959,체질효율,"선별장의 실제 조업에 있어서의 체질은 처리 능력을 생각해야 하므로 완전한 체질이 잘 안 된다. 따라서, 체 밑으로 빠져야 할 망하 산물이 체 위에 망상 산물로 남게 되는데, 이것이 적을수록 체질이 잘 된 것이며, 체질의 효율이 좋아진다.",
960,초염기성암석,"실리카(SiO2)의 함유량이 중량 %로 455이하인 화성암, 주로 고철질 광물이나 철산화물로 구성되었으며 색지수가 70이상이다. 감람암, 피크라이트(picrite)가 그 예이다. 초고철질암은 동의의.","超鹽基性巖石, ultrabasic rocks"
961,총광량(總鑛量,총광량을 구하는 식은 다음과 같다. 총평균맥폭,총광량(總鑛量
962,총포·도검·화약류 단속법,"현재 우리 나라에서 총포·도검·화약류의 제조, 사용 등 취급에 관한 사항을 규제하는 법령으로는, 1961년 12월 13일 법률 제855호로 공포되어 몇 차례 수정, 보완된 총포·도검·화약류 단속법이 있다. 그리고 이의 효율적인 시행을 위해 필요한 사항을 규정한 위의 법의 시행령이 있으며, 위의 법 및 시행령에서 위임된 사항과 그 시행에 관하여 필요한 사항을 규정하고 있는 시행 규칙이 있다. 1.목적 및 정의 이 법의 목적은, 화약류의 제조, 거래, 소지, 사용, 그 밖의 취급에 관한 사항을 규제하여 화약류로 인한 위험과 재해를 미리 방지함으로써 공공의 안전을 유지하는 데 있다. 한편, 이 법에서 정의하는 화약류는 화약, 폭약 및 화공품으로 나누어진다. 2. 화약류 관리 보안 책임자의 선임 및 업무 화약류의 관리 보안 책임자 면허의 종류는 1급 및 2급으로 구분하고 화약류 관리 보안 책임자는 저장소의 위치, 구조 및 설비가 화약류 저장소 설치 허가 규정에 의한 허가를 받지 않고 변경되는 일이 없도록 해야 하고, 화약류 저장상의 취급 또는 저장소의 위치, 구조 및 설비가 관계 법령의 기준에 따라 설치, 유지되도록 해야 한다. 그리고 저장소가 인근의 화재나 그 밖의 사정으로 위험하거나 화약류의 안전도에 이상이 있을 때에는 응급 조치를 지휘해야 하며, 화약류 취급 및 저장량 등에 관한 규정이 잘 준수되도록 지도, 감독 해야 한다.",
963,총포뇌관,"뇌관을 격침으로 타격하여 폭약을 발화시키는 뇌관을 타격 뇌관이라 하고, 그 중에서 총포의 발사약을 점화시키는 데 사용되고 있는 뇌관을 말한다.",銃砲雷管
964,"최무선(崔茂宣, 1325-1395)","고려말-조선초의 발명가. 본관은 영주(永州, 永川). 원나라 이원(李元)에게서 그 제조법을 배웠다. 1377(우왕 3)년에 화통도감(火　都監)을 설치케 하여 화약을 만들고 대장군(大將軍)·이장군(二將軍)·삼장군·육화(六花)·석포(石砲)·화포·신포(信砲)·화통·화전·철령전 등 각종 화기를 제작함.",
965,추관,다이아몬드 시추에서 다이아몬드를 구리 또는 연으로 만든 관에 드문드문 박은 것을 말함.,Crown Bit
966,추정광량,"1) 광체를 육면체로 생각하여 시추나 갱도 탐사 등으로 매장광량을 계산 할 경우 2-3면이 확인 되면 추정광량이라 말함. 2) 갱도, 갱정, 시추구멍 등에 의해 용적, 비중 및 품위가 추정되는 광량을 말한다.",possible ore reserves
967,축전지식 전기기관차,"축전지 충전으로 움직이는 기관차이며 수평갱도에서만 사용할 수 있다. 교대할 때 마다 충전이 된 축전지를 바꿔야 하는 불편이 있으나, 폭발성 가스에 대하여 비교적 안전하고, 운행비도 적게 드는 편이다. 대체적으로 축전지식 전기 기관차의 무게는 3-8톤이다.",
968,축전차,연축전지를 동력원으로 하여 갱내에서 운행하는 축전지식 전기기관차를 말한다.,蓄電車
969,충격감도,"화약류가 충격에 의하여 폭발하는 성질로서, 화약의 제조, 운반, 취급 및 사용에 있어서 대단히 중요한 성질이다. 충격의 종류에는 물리적 힘에 의한 기계적 충격과 뇌관이나 폭약이 폭발할 때 발생하는 폭발 충격이 있다. 기계적 충격 감도는 타격 감도로서, 낙추 시험으로 측정한다.",衝擊感度
970,충격기폭,"화약이 충격에 의하여 폭발적 분해 반응을 일으키는 것은 분자 감응에 원인이 있으며, 분자 감응의 예를 들면 다음과 같다. 빠른 속도로 운동하고 있는 분자, 즉 큰 운동 예너지를 가진 두분자 A와 B가 서로 충돌하면, 한쪽 분자 A의 운동에너지는 감소하고, 다른 한쪽 분자 B의 내부 에너지는 증가한다. 이 때, A분자에서 감소된 운동 에너지는 B분자의 분해 반응을 활성화시키는 데 사용된다. 어떤 분자의 내부 에너지의 양이 충격에 의하여 순간적으로 변화한다면, 그 분자는 원래의 위치에서 벗어나 높은 온도로 가열될 것이다. 그러므로 1개 분자의 운동 에너지가 감응에 의하여 다른 분자에게 반응을 촉진시키는 활성화 에너지로 이용되면, 이 에너지를 받은 분자는 분해될 가능성이 있다. 한 덩어리의 화약에 외부에서 충격을 주면 충격파는 화약 안으로 퍼지고, 이 충격파의 중심에서부터 폭발 반응이 일어나는데, 이러한 반응이 짧은 시간에 연쇄적으로 일어나게 되면 폭발이 일어난다.",衝擊起爆
971,충격식,시추방법 중 하나로서 마멸 강도가 다소 약하더라도 강성이 강한 재료로 암석에 충격을 주어서 정으로 깨어 내는 것과 같은 원리를 적용하는 방법.,
972,충격식보오링,"탐광방법 분류상 회전식과 충격식으로 나뉘며, 충격식에는 엠파이어 시추, 로드 시추, 상총굴, 관시추 등이 해당된다.",
973,충격식코울커터,탄층 중에 연한 암층이 끼어 있을 때에는 착암기와 같은 구조를 가진 충격식 코울 커터 (percu--ssion type coal cutter)를 사용할 때도 있다.,
974,충격파,"화약류는 발파 또는 군사 목적 등과 같은 일정한 목적에 사용된다. 일반적으로 폭약의 폭발 에너지의 대부분은 원하는 목적에 사용 되지만, 나머지 에너지는 주위의 매체, 즉 공기나 물 또는 고체 등을 통하여 외부로 전달된다. 이렇게 주위의 매체를 통하여 외부로 전파되는 에너지는 지름이 다른 여러 개의 원의 모양으로 전파되는데, 이 파동 형태의 에너지를 충격파라 한다. 즉 충격파란 폭약 사용의 1차적인 목적 이외에 2차적으로 발생하는 폭약의 효과라 할 수 있다.",
